20:00:00.387846 IP 103.217.155.20.17466 > 203.50.110.205.ntp:  [|ntp]
20:00:00.388214 IP 45.189.21.71.57474 > 150.204.70.75.ntp:  [|ntp]
20:00:00.388360 IP 108.221.244.23.42867 > 163.162.28.222.ntp:  [|ntp]
20:00:00.388365 IP 180.200.180.103.47767 > 203.50.111.16.ntp:  [|ntp]
20:00:00.388469 IP 180.200.180.103.61318 > 203.50.111.16.ntp:  [|ntp]
20:00:00.388616 IP 116.203.215.57.32542 > 203.50.110.205.ntp:  [|ntp]
20:00:00.389535 IP 206.13.206.231.47725 > 203.50.111.36.domain: 23830 [1au][|domain]
20:00:00.390416 IP 139.246.115.68.45572 > 203.50.111.16.ntp:  [|ntp]
20:00:00.390442 IP 116.203.215.57.57734 > 203.50.110.205.ntp:  [|ntp]
20:00:00.390565 IP 103.217.155.20.63283 > 203.50.111.16.ntp:  [|ntp]
20:00:00.390616 IP 103.240.69.37.30455 > 203.50.109.226.ntp:  [|ntp]
20:00:00.390639 IP 139.246.115.68.8096 > 203.50.111.16.ntp:  [|ntp]
20:00:00.390731 IP 180.200.180.103.61318 > 203.50.110.205.ntp:  [|ntp]
20:00:00.391070 IP 139.246.115.68.8096 > 203.50.110.205.ntp:  [|ntp]
20:00:00.391071 IP 133.24.194.142.53922 > 192.67.28.246.8801: UDP, length 1096
20:00:00.391315 IP 101.185.73.120.53642 > 203.50.111.16.ntp:  [|ntp]
20:00:00.391858 IP 133.24.194.142.49602 > 192.67.28.246.8801: UDP, length 192
20:00:00.392036 IP 208.209.119.221.3478 > 163.162.248.170.62339: UDP, length 68
20:00:00.392160 IP 133.24.52.157.domain > 91.87.214.233.50625: 48392*-[|domain]
20:00:00.392357 IP 208.143.198.208.domain > 163.162.158.187.47258: 52223*-[|domain]
20:00:00.392826 IP 116.203.215.57.35891 > 203.50.111.16.ntp:  [|ntp]
20:00:00.392939 IP 103.217.155.20.40446 > 203.50.111.16.ntp:  [|ntp]
20:00:00.393280 IP 23.152.222.23.domain > 163.162.158.155.21407: 3056*-[|domain]
20:00:00.393586 IP 103.217.155.20.55142 > 203.50.111.16.ntp:  [|ntp]
20:00:00.394864 IP 115.227.134.35.47437 > 203.50.110.205.ntp:  [|ntp]
20:00:00.394934 IP 124.169.15.115.49580 > 133.245.171.125.netbios-ns: [|SMB]
20:00:00.395211 IP 203.50.110.55.41745 > 192.250.148.105.domain: 64507[|domain]
20:00:00.395416 IP 163.162.158.190.28816 > 54.164.157.223.domain: 9127% [1au][|domain]
20:00:00.395826 IP 159.201.175.229.53682 > 163.162.3.133.53413: UDP, length 29
20:00:00.395996 IP 104.76.217.229.46365 > 150.204.179.135.53413: UDP, length 29
20:00:00.396210 IP 116.203.215.57.5276 > 203.50.110.205.ntp:  [|ntp]
20:00:00.396211 IP 113.177.211.204.7859 > 133.4.123.182.50348: UDP, length 104
20:00:00.396329 IP 116.203.215.57.54870 > 203.50.110.205.ntp:  [|ntp]
20:00:00.396411 IP 209.222.56.37.31420 > 163.162.99.237.3074: UDP, length 128
20:00:00.396641 IP 124.216.199.157.49111 > 203.50.109.226.ntp:  [|ntp]
20:00:00.397073 IP 202.133.13.220.domain > 203.179.233.141.45386: 34458*-[|domain]
20:00:00.397366 IP 180.200.180.103.47473 > 203.50.110.205.ntp:  [|ntp]
20:00:00.397735 IP 101.185.73.120.49211 > 203.50.111.16.ntp:  [|ntp]
20:00:00.397847 IP 139.246.115.68.53740 > 203.50.111.16.ntp:  [|ntp]
20:00:00.397883 IP 203.50.111.36.domain > 206.13.206.231.47725: 23830*-[|domain]
20:00:00.398504 IP 185.133.152.85.53481 > 163.162.123.168.5683: UDP, length 5
20:00:00.398640 IP 71.0.38.121.domain > 150.204.90.63.domain: 13551+[|domain]
20:00:00.398780 IP 208.128.37.223.domain > 202.133.50.250.57878: 1269[|domain]
20:00:00.399140 IP 185.90.219.82.80 > 163.162.83.1.domain: 54501+ [1au][|domain]
20:00:00.399461 IP 139.246.115.68.45572 > 203.50.110.205.ntp:  [|ntp]
20:00:00.400171 IP 118.145.253.111.domain > 163.162.159.158.24324: 38542*-[|domain]
20:00:00.400537 IP 139.246.115.68.57113 > 203.50.110.205.ntp:  [|ntp]
20:00:00.402054 IP 103.217.155.20.41049 > 203.50.110.205.ntp:  [|ntp]
20:00:00.402218 IP 133.24.165.44.44061 > 68.109.102.32.12799: UDP, length 80
20:00:00.402527 IP 47.164.138.168.7074 > 203.50.110.205.ntp:  [|ntp]
20:00:00.402530 IP 180.200.180.103.41324 > 203.50.111.16.ntp:  [|ntp]
20:00:00.402853 IP 133.24.150.6.domain > 54.114.153.126.6520: 37802*-[|domain]
20:00:00.403118 IP 133.24.150.110.domain > 54.114.153.126.36679: 790*-[|domain]
20:00:00.403276 IP 103.217.155.20.64703 > 203.50.110.205.ntp:  [|ntp]
20:00:00.403545 IP 103.217.155.20.55408 > 203.50.111.16.ntp:  [|ntp]
20:00:00.403547 IP 180.200.180.107.34675 > 203.50.111.16.ntp:  [|ntp]
20:00:00.403851 IP 107.15.13.55.30455 > 163.162.248.209.53017: UDP, length 39
20:00:00.404151 IP 133.24.215.78.3027 > 112.113.71.228.10972: UDP, length 37
20:00:00.404669 IP 163.162.248.209.53017 > 107.15.13.55.30455: UDP, length 65
20:00:00.404747 IP 133.24.215.78.3027 > 112.113.71.228.10972: UDP, length 37
20:00:00.404887 IP 116.203.215.57.35891 > 203.50.110.205.ntp:  [|ntp]
20:00:00.405311 IP 133.24.215.78.3027 > 112.113.71.228.10972: UDP, length 37
20:00:00.405790 IP 103.217.155.20.40446 > 203.50.110.205.ntp:  [|ntp]
20:00:00.405859 IP 180.200.180.107.34675 > 203.50.110.205.ntp:  [|ntp]
20:00:00.406405 IP 101.185.73.120.53642 > 203.50.110.205.ntp:  [|ntp]
20:00:00.406775 IP 45.189.243.113.51889 > 163.162.74.233.ntp:  [|ntp]
20:00:00.406887 IP 180.200.180.107.45253 > 203.50.111.16.ntp:  [|ntp]
20:00:00.406966 IP 103.217.155.20.36836 > 203.50.111.16.ntp:  [|ntp]
20:00:00.406970 IP 133.24.150.6.domain > 54.114.153.126.56159: 1220*-[|domain]
20:00:00.407126 IP 47.162.192.168.51986 > 203.50.110.205.ntp:  [|ntp]
20:00:00.407500 IP 47.164.138.168.9641 > 203.50.110.205.ntp:  [|ntp]
20:00:00.407590 IP 185.90.219.82.80 > 150.204.186.86.domain: 54501+ [1au][|domain]
20:00:00.407592 IP 115.227.134.35.61563 > 203.50.110.205.ntp:  [|ntp]
20:00:00.407886 IP 116.203.215.57.23738 > 203.50.110.205.ntp:  [|ntp]
20:00:00.407936 IP 104.28.183.167.domain > 163.162.158.190.60066: 63961*-[|domain]
20:00:00.407941 IP 104.28.177.231.domain > 163.162.159.156.19917: 31290*-[|domain]
20:00:00.408111 IP 104.28.177.231.domain > 163.162.159.189.9153: 64399*-[|domain]
20:00:00.408507 IP 104.28.183.167.domain > 163.162.159.191.39427: 43381*-[|domain]
20:00:00.408963 IP 103.217.155.20.55408 > 203.50.110.205.ntp:  [|ntp]
20:00:00.409840 IP 104.28.177.231.domain > 163.162.159.157.62095: 57191*-[|domain]
20:00:00.410048 IP 23.152.219.111.domain > 163.162.159.186.39025: 36371*-[|domain]
20:00:00.411508 IP 133.24.194.142.53922 > 192.67.28.246.8801: UDP, length 1073
20:00:00.411565 IP 133.24.215.78.3027 > 112.113.71.228.10972: UDP, length 37
20:00:00.411727 IP 163.162.158.154.25681 > 205.199.208.214.domain: 8561% [1au][|domain]
20:00:00.411972 IP 133.24.215.78.3027 > 125.74.131.96.5110: UDP, length 38
20:00:00.412009 IP 204.223.175.67.57966 > 203.50.111.59.domain: 50528% [1au][|domain]
20:00:00.412093 IP 175.187.141.176.26400 > 150.204.195.18.54748: UDP, length 104
20:00:00.412232 IP 204.223.175.67.57853 > 203.50.111.59.domain: 7798% [1au][|domain]
20:00:00.412236 IP 103.217.155.20.22534 > 203.50.111.16.ntp:  [|ntp]
20:00:00.412701 IP 182.101.68.14.6085 > 133.4.123.213.50356: UDP, length 20
20:00:00.412901 IP 101.185.73.120.3740 > 203.50.111.16.ntp:  [|ntp]
20:00:00.413124 IP 180.200.180.107.23715 > 203.50.110.205.ntp:  [|ntp]
20:00:00.413167 IP 139.246.115.68.28805 > 203.50.111.16.ntp:  [|ntp]
20:00:00.413178 IP 139.246.115.68.47324 > 203.50.110.205.ntp:  [|ntp]
20:00:00.413180 IP 180.200.180.107.23715 > 203.50.111.16.ntp:  [|ntp]
20:00:00.413255 IP 209.222.56.37.31420 > 163.162.99.237.3074: UDP, length 196
20:00:00.413696 IP 71.0.38.101.domain > 202.133.30.246.domain: 13551+[|domain]
20:00:00.414105 IP 133.24.194.142.49602 > 192.67.28.246.8801: UDP, length 66
20:00:00.414273 IP 104.76.217.229.50076 > 203.50.90.150.53413: UDP, length 29
20:00:00.414275 IP 103.217.155.20.36836 > 203.50.110.205.ntp:  [|ntp]
20:00:00.414801 IP 124.169.15.115.47949 > 133.245.164.255.netbios-ns: [|SMB]
20:00:00.415138 IP 133.24.165.44.44061 > 68.109.102.32.12799: UDP, length 799
20:00:00.415363 IP 163.162.114.57.50505 > 126.240.198.29.52333: UDP, length 316
20:00:00.416133 IP 126.240.198.29.52333 > 163.162.248.136.59764: UDP, length 188
20:00:00.416254 IP 126.240.198.29.52333 > 163.162.114.57.50505: UDP, length 268
20:00:00.416870 IP 47.164.138.168.45871 > 203.50.111.16.ntp:  [|ntp]
20:00:00.416993 IP 47.164.138.168.6614 > 203.50.111.16.ntp:  [|ntp]
20:00:00.417022 IP 139.246.115.68.58076 > 203.50.110.205.ntp:  [|ntp]
20:00:00.417090 IP 101.185.73.120.41506 > 203.50.111.16.ntp:  [|ntp]
20:00:00.417147 IP 163.162.114.57.50505 > 122.14.134.185.58228: UDP, length 316
20:00:00.417337 IP 23.152.222.23.domain > 202.133.50.192.29273: 15954*-[|domain]
20:00:00.417407 IP 133.24.165.44.44061 > 68.109.102.32.12799: UDP, length 1043
20:00:00.417811 IP 116.203.215.57.7080 > 203.50.111.16.ntp:  [|ntp]
20:00:00.417814 IP 180.200.180.103.47767 > 203.50.111.16.ntp:  [|ntp]
20:00:00.417815 IP 174.199.63.22.domain > 202.139.239.49.5296: 22234*-[|domain]
20:00:00.418119 IP 116.203.215.57.28447 > 203.50.111.16.ntp:  [|ntp]
20:00:00.418326 IP 116.203.215.57.5307 > 203.50.111.16.ntp:  [|ntp]
20:00:00.418577 IP 133.24.215.78.3027 > 182.143.99.255.11570: UDP, length 37
20:00:00.419058 IP 133.24.215.78.3027 > 112.113.71.228.10972: UDP, length 37
20:00:00.419253 IP 133.24.52.157.domain > 54.124.154.19.17128: 53470*-[|domain]
20:00:00.419491 IP 160.232.165.45.49726 > 203.50.109.231.ntp:  [|ntp]
20:00:00.420030 IP 133.24.165.44.44061 > 68.109.102.32.12799: UDP, length 77
20:00:00.420171 IP 180.200.180.103.47767 > 203.50.110.205.ntp:  [|ntp]
20:00:00.420308 IP 133.24.149.253.63199 > 123.58.130.241.domain: 61746% [1au][|domain]
20:00:00.420350 IP 133.24.215.78.3027 > 112.113.71.228.10972: UDP, length 37
20:00:00.420706 IP 163.162.177.72.ipsec-nat-t > 126.31.146.18.49157: [|isakmp]
20:00:00.420809 IP 103.217.155.20.37070 > 203.50.111.16.ntp:  [|ntp]
20:00:00.420865 IP 163.162.177.72.ipsec-nat-t > 126.31.146.18.49157: [|isakmp]
20:00:00.421169 IP 139.246.115.68.7390 > 203.50.110.205.ntp:  [|ntp]
20:00:00.421209 IP 101.185.73.120.43171 > 203.50.111.16.ntp:  [|ntp]
20:00:00.421901 IP 133.24.215.78.3027 > 112.113.71.228.10972: UDP, length 37
20:00:00.422402 IP 204.223.175.67.57731 > 203.50.111.59.domain: 34571% [1au][|domain]
20:00:00.422528 IP 103.217.155.20.17312 > 203.50.110.205.ntp:  [|ntp]
20:00:00.422584 IP 124.169.15.115.48063 > 133.245.171.125.netbios-ns: [|SMB]
20:00:00.423080 IP 104.76.217.229.52684 > 150.204.52.124.53413: UDP, length 29
20:00:00.423248 IP 133.24.215.78.3027 > 112.113.71.228.10972: UDP, length 37
20:00:00.423425 IP 107.15.13.55.30455 > 163.162.248.209.53017: UDP, length 38
20:00:00.423446 IP 185.90.219.82.80 > 202.139.235.90.domain: 54501+ [1au][|domain]
20:00:00.423824 IP 133.24.52.157.domain > 54.194.169.229.35589: 16641*-[|domain]
20:00:00.423862 IP 116.203.215.57.29212 > 203.50.110.205.ntp:  [|ntp]
20:00:00.423881 IP 103.217.155.20.37070 > 203.50.110.205.ntp:  [|ntp]
20:00:00.425199 IP 74.157.132.129.53675 > 202.133.50.207.domain: 62538[|domain]
20:00:00.425258 IP 47.162.192.168.20854 > 203.50.110.205.ntp:  [|ntp]
20:00:00.425495 IP 163.162.248.209.53017 > 107.15.13.55.30455: UDP, length 68
20:00:00.425881 IP 133.24.194.142.53922 > 192.67.28.246.8801: UDP, length 1073
20:00:00.425966 IP 116.203.215.57.5307 > 203.50.110.205.ntp:  [|ntp]
20:00:00.426345 IP 139.246.115.68.4073 > 203.50.111.16.ntp:  [|ntp]
20:00:00.426501 IP 203.50.111.59.domain > 213.156.21.219.42877: 16402*-[|domain]
20:00:00.426761 IP 216.177.98.53.domain > 202.139.239.49.38177: 38806*-[|domain]
20:00:00.426813 IP 133.24.215.78.3027 > 112.113.71.228.10972: UDP, length 37
20:00:00.426874 IP 133.24.215.78.3027 > 182.143.99.255.11570: UDP, length 37
20:00:00.427104 IP 133.24.215.78.3027 > 112.113.71.228.10972: UDP, length 37
20:00:00.427169 IP 133.24.215.78.3027 > 112.113.71.228.10972: UDP, length 37
20:00:00.427663 IP 133.24.215.78.3027 > 112.113.71.228.10972: UDP, length 37
20:00:00.427704 IP 103.217.155.20.64703 > 203.50.111.16.ntp:  [|ntp]
20:00:00.428143 IP 133.24.150.109.domain > 52.196.144.176.12720: 38030-[|domain]
20:00:00.428235 IP 209.222.56.37.31420 > 163.162.99.237.3074: UDP, length 134
20:00:00.428558 IP 218.23.131.34.14651 > 202.133.41.178.sunrpc: UDP, length 40
20:00:00.429187 IP 133.24.150.110.domain > 52.196.144.176.43769: 29804*-[|domain]
20:00:00.429819 IP 192.252.173.199.domain > 203.50.106.12.34830: 54982 NXDomain*-[|domain]
20:00:00.429855 IP 101.185.73.120.53642 > 203.50.111.16.ntp:  [|ntp]
20:00:00.430034 IP 133.24.52.157.domain > 61.227.122.70.8400: 30360*-[|domain]
20:00:00.430921 IP 124.216.199.157.61504 > 203.50.109.226.ntp:  [|ntp]
20:00:00.430980 IP 139.246.115.68.13106 > 203.50.110.205.ntp:  [|ntp]
20:00:00.431316 IP 133.24.215.78.3027 > 116.251.52.101.19977: UDP, length 37
20:00:00.431392 IP 139.246.115.68.2419 > 203.50.111.16.ntp:  [|ntp]
20:00:00.431738 IP 133.24.194.142.53922 > 192.67.28.246.8801: UDP, length 1072
20:00:00.431753 IP 116.203.215.57.28447 > 203.50.110.205.ntp:  [|ntp]
20:00:00.431785 IP 139.246.115.68.4073 > 203.50.110.205.ntp:  [|ntp]
20:00:00.432041 IP 104.28.177.231.domain > 163.162.159.188.57933: 58854*-[|domain]
20:00:00.432276 IP 133.24.194.142.49602 > 192.67.28.246.8801: UDP, length 221
20:00:00.433169 IP 180.200.180.103.47473 > 203.50.111.16.ntp:  [|ntp]
20:00:00.433761 IP 133.24.52.157.domain > 52.214.159.229.37914: 32244*-[|domain]
20:00:00.433852 IP 133.24.142.75.6889 > 80.66.155.94.23191: UDP, length 302
20:00:00.433947 IP 101.185.73.120.61623 > 203.50.111.16.ntp:  [|ntp]
20:00:00.434117 IP 103.217.155.20.49206 > 203.50.111.16.ntp:  [|ntp]
20:00:00.434119 IP 47.162.192.168.41384 > 203.50.110.205.ntp:  [|ntp]
20:00:00.434577 IP 139.246.115.68.2419 > 203.50.110.205.ntp:  [|ntp]
20:00:00.434679 IP 180.200.180.103.41324 > 203.50.110.205.ntp:  [|ntp]
20:00:00.434833 IP 139.246.115.68.7969 > 203.50.111.16.ntp:  [|ntp]
20:00:00.435272 IP 133.24.165.44.44061 > 68.109.102.32.12799: UDP, length 83
20:00:00.435273 IP 163.162.248.136.59764 > 122.14.134.185.58228: UDP, length 252
20:00:00.435796 IP 163.162.248.136.59764 > 126.240.198.29.52333: UDP, length 236
20:00:00.435991 IP 133.24.215.78.3027 > 182.143.99.255.11570: UDP, length 37
20:00:00.436158 IP 104.76.217.229.51672 > 150.204.221.106.53413: UDP, length 29
20:00:00.436543 IP 133.24.215.78.3027 > 182.253.198.195.63144: UDP, length 37
20:00:00.436562 IP 116.203.215.57.5983 > 203.50.110.205.ntp:  [|ntp]
20:00:00.436730 IP 133.24.215.78.3027 > 182.253.198.195.63144: UDP, length 37
20:00:00.437085 IP 133.24.52.157.domain > 67.193.34.103.58997: 53357*-[|domain]
20:00:00.437276 IP 133.24.215.78.3027 > 182.253.198.195.63144: UDP, length 37
20:00:00.437279 IP 205.199.214.106.domain > 202.139.239.49.11817: 7668*-[|domain]
20:00:00.437427 IP 133.24.215.78.3027 > 182.253.198.195.63144: UDP, length 89
20:00:00.437455 IP 210.10.84.11.domain > 163.162.158.190.61360: 3190*-[|domain]
20:00:00.437702 IP 47.164.138.168.47399 > 203.50.110.205.ntp:  [|ntp]
20:00:00.437913 IP 160.232.165.45.53152 > 203.50.109.231.ntp:  [|ntp]
20:00:00.438012 IP 133.24.215.78.3027 > 182.253.198.195.63144: UDP, length 37
20:00:00.438112 IP 103.217.155.20.49206 > 203.50.110.205.ntp:  [|ntp]
20:00:00.438181 IP 133.24.215.78.3027 > 112.113.71.228.10972: UDP, length 37
20:00:00.438660 IP 47.164.138.168.57028 > 203.50.110.205.ntp:  [|ntp]
20:00:00.438944 IP 101.185.73.120.61623 > 203.50.110.205.ntp:  [|ntp]
20:00:00.439201 IP 139.246.115.68.36587 > 203.50.110.205.ntp:  [|ntp]
20:00:00.439700 IP 116.203.215.57.54870 > 203.50.111.16.ntp:  [|ntp]
20:00:00.439942 IP 71.0.38.122.domain > 203.50.111.205.domain: 13551+[|domain]
20:00:00.442229 IP 116.203.215.57.57734 > 203.50.110.205.ntp:  [|ntp]
20:00:00.442503 IP 124.169.15.115.43171 > 133.245.164.255.netbios-ns: [|SMB]
20:00:00.442884 IP 133.24.52.157.domain > 143.108.202.211.33753: 50382*-[|domain]
20:00:00.444694 IP 120.129.203.184.48425 > 203.50.109.231.ntp:  [|ntp]
20:00:00.444817 IP 133.24.194.142.53922 > 192.67.28.246.8801: UDP, length 1104
20:00:00.444877 IP 139.246.115.68.62699 > 203.50.110.205.ntp:  [|ntp]
20:00:00.445183 IP 163.162.248.209.53017 > 107.15.13.55.30455: UDP, length 71
20:00:00.445186 IP 133.24.194.142.53922 > 192.67.28.246.8801: UDP, length 1117
20:00:00.445365 IP 103.217.155.20.35852 > 203.50.110.205.ntp:  [|ntp]
20:00:00.445538 IP 103.217.155.20.35852 > 203.50.111.16.ntp:  [|ntp]
20:00:00.446032 IP 103.240.69.37.53193 > 203.50.109.231.ntp:  [|ntp]
20:00:00.446285 IP 203.50.109.231.ntp > 120.129.203.184.48425:  [|ntp]
20:00:00.446286 IP 203.50.109.231.ntp > 120.129.203.184.48425:  [|ntp]
20:00:00.446288 IP 203.50.109.231.ntp > 120.129.203.184.48425:  [|ntp]
20:00:00.446289 IP 203.50.109.231.ntp > 120.129.203.184.48425:  [|ntp]
20:00:00.446291 IP 203.50.109.231.ntp > 120.129.203.184.48425:  [|ntp]
20:00:00.446292 IP 203.50.109.231.ntp > 120.129.203.184.48425:  [|ntp]
20:00:00.446294 IP 203.50.109.231.ntp > 120.129.203.184.48425:  [|ntp]
20:00:00.446295 IP 203.50.109.231.ntp > 120.129.203.184.48425:  [|ntp]
20:00:00.446298 IP 203.50.109.231.ntp > 120.129.203.184.48425:  [|ntp]
20:00:00.446299 IP 203.50.109.231.ntp > 120.129.203.184.48425:  [|ntp]
20:00:00.446300 IP 203.50.109.231.ntp > 120.129.203.184.48425:  [|ntp]
20:00:00.446302 IP 203.50.109.231.ntp > 120.129.203.184.48425:  [|ntp]
20:00:00.446303 IP 203.50.109.231.ntp > 120.129.203.184.48425:  [|ntp]
20:00:00.446305 IP 203.50.109.231.ntp > 120.129.203.184.48425:  [|ntp]
20:00:00.446305 IP 203.50.109.231.ntp > 120.129.203.184.48425:  [|ntp]
20:00:00.446306 IP 203.50.109.231.ntp > 120.129.203.184.48425:  [|ntp]
20:00:00.446307 IP 203.50.109.231.ntp > 120.129.203.184.48425:  [|ntp]
20:00:00.446308 IP 203.50.109.231.ntp > 120.129.203.184.48425:  [|ntp]
20:00:00.446313 IP 203.50.109.231.ntp > 120.129.203.184.48425:  [|ntp]
20:00:00.446314 IP 203.50.109.231.ntp > 120.129.203.184.48425:  [|ntp]
20:00:00.446315 IP 203.50.109.231.ntp > 120.129.203.184.48425:  [|ntp]
20:00:00.446316 IP 203.50.109.231.ntp > 120.129.203.184.48425:  [|ntp]
20:00:00.446388 IP 203.50.109.231.ntp > 120.129.203.184.48425:  [|ntp]
20:00:00.446389 IP 203.50.109.231.ntp > 120.129.203.184.48425:  [|ntp]
20:00:00.446390 IP 203.50.109.231.ntp > 120.129.203.184.48425:  [|ntp]
20:00:00.446391 IP 203.50.109.231.ntp > 120.129.203.184.48425:  [|ntp]
20:00:00.446392 IP 203.50.109.231.ntp > 120.129.203.184.48425:  [|ntp]
20:00:00.446393 IP 203.50.109.231.ntp > 120.129.203.184.48425:  [|ntp]
20:00:00.446394 IP 203.50.109.231.ntp > 120.129.203.184.48425:  [|ntp]
20:00:00.446439 IP 203.50.109.231.ntp > 120.129.203.184.48425:  [|ntp]
20:00:00.446486 IP 203.50.109.231.ntp > 120.129.203.184.48425:  [|ntp]
20:00:00.446489 IP 203.50.109.231.ntp > 120.129.203.184.48425:  [|ntp]
20:00:00.446490 IP 203.50.109.231.ntp > 120.129.203.184.48425:  [|ntp]
20:00:00.446491 IP 203.50.109.231.ntp > 120.129.203.184.48425:  [|ntp]
20:00:00.446494 IP 203.50.109.231.ntp > 120.129.203.184.48425:  [|ntp]
20:00:00.446524 IP 203.50.109.231.ntp > 120.129.203.184.48425:  [|ntp]
20:00:00.446525 IP 203.50.109.231.ntp > 120.129.203.184.48425:  [|ntp]
20:00:00.446526 IP 203.50.109.231.ntp > 120.129.203.184.48425:  [|ntp]
20:00:00.446527 IP 203.50.109.231.ntp > 120.129.203.184.48425:  [|ntp]
20:00:00.446527 IP 203.50.109.231.ntp > 120.129.203.184.48425:  [|ntp]
20:00:00.446529 IP 203.50.109.231.ntp > 120.129.203.184.48425:  [|ntp]
20:00:00.446529 IP 203.50.109.231.ntp > 120.129.203.184.48425:  [|ntp]
20:00:00.446530 IP 203.50.109.231.ntp > 120.129.203.184.48425:  [|ntp]
20:00:00.446688 IP 203.50.109.231.ntp > 120.129.203.184.48425:  [|ntp]
20:00:00.446690 IP 203.50.109.231.ntp > 120.129.203.184.48425:  [|ntp]
20:00:00.446691 IP 203.50.109.231.ntp > 120.129.203.184.48425:  [|ntp]
20:00:00.446692 IP 203.50.109.231.ntp > 120.129.203.184.48425:  [|ntp]
20:00:00.446693 IP 203.50.109.231.ntp > 120.129.203.184.48425:  [|ntp]
20:00:00.446694 IP 203.50.109.231.ntp > 120.129.203.184.48425:  [|ntp]
20:00:00.446695 IP 203.50.109.231.ntp > 120.129.203.184.48425:  [|ntp]
20:00:00.446696 IP 203.50.109.231.ntp > 120.129.203.184.48425:  [|ntp]
20:00:00.446697 IP 203.50.109.231.ntp > 120.129.203.184.48425:  [|ntp]
20:00:00.446698 IP 203.50.109.231.ntp > 120.129.203.184.48425:  [|ntp]
20:00:00.446699 IP 203.50.109.231.ntp > 120.129.203.184.48425:  [|ntp]
20:00:00.446700 IP 203.50.109.231.ntp > 120.129.203.184.48425:  [|ntp]
20:00:00.446701 IP 203.50.109.231.ntp > 120.129.203.184.48425:  [|ntp]
20:00:00.447166 IP 180.200.180.103.47473 > 203.50.110.205.ntp:  [|ntp]
20:00:00.447168 IP 209.222.56.37.31420 > 163.162.99.237.3074: UDP, length 140
20:00:00.447923 IP 122.14.134.185.58228 > 163.162.114.57.50505: UDP, length 300
20:00:00.448004 IP 139.246.115.68.8096 > 203.50.110.205.ntp:  [|ntp]
20:00:00.448105 IP 107.15.13.55.30455 > 163.162.248.209.53017: UDP, length 49
20:00:00.448810 IP 202.133.25.174.51182 > 198.142.95.181.domain: 46041% [1au][|domain]
20:00:00.449340 IP 184.173.254.103.domain > 163.162.159.157.17302: 22518*-[|domain]
20:00:00.449408 IP 122.14.134.185.58228 > 163.162.248.136.59764: UDP, length 220
20:00:00.449744 IP 139.246.115.68.7969 > 203.50.110.205.ntp:  [|ntp]
20:00:00.449750 IP 47.164.138.168.45871 > 203.50.110.205.ntp:  [|ntp]
20:00:00.450123 IP 133.24.194.142.53922 > 192.67.28.246.8801: UDP, length 1117
20:00:00.450209 IP 139.246.115.68.47324 > 203.50.111.16.ntp:  [|ntp]
20:00:00.450872 IP 133.24.194.142.49602 > 192.67.28.246.8801: UDP, length 218
20:00:00.451016 IP 101.185.73.120.38939 > 203.50.110.205.ntp:  [|ntp]
20:00:00.452200 IP 133.24.215.78.3027 > 112.113.71.228.10972: UDP, length 37
20:00:00.452648 IP 133.24.165.44.44061 > 68.109.102.32.12799: UDP, length 68
20:00:00.452673 IP 133.24.215.78.3027 > 112.113.71.228.10972: UDP, length 37
20:00:00.453014 IP 47.164.138.168.9641 > 203.50.111.16.ntp:  [|ntp]
20:00:00.453245 IP 133.24.215.78.3027 > 112.113.71.228.10972: UDP, length 37
20:00:00.453251 IP 103.217.155.20.41049 > 203.50.110.205.ntp:  [|ntp]
20:00:00.453414 IP 92.196.28.91.5209 > 150.204.246.26.sip: SIP
20:00:00.454236 IP 47.164.138.168.9641 > 203.50.110.205.ntp:  [|ntp]
20:00:00.454373 IP 133.24.215.78.3027 > 112.113.71.228.10972: UDP, length 37
20:00:00.454540 IP 133.24.215.78.3027 > 112.113.71.228.10972: UDP, length 37
20:00:00.455036 IP 116.203.215.57.5276 > 203.50.110.205.ntp:  [|ntp]
20:00:00.455320 IP 133.24.215.78.3027 > 112.113.71.228.10972: UDP, length 38
20:00:00.455409 IP 101.185.73.120.53642 > 203.50.110.205.ntp:  [|ntp]
20:00:00.455896 IP 133.24.215.78.3027 > 112.113.71.228.10972: UDP, length 37
20:00:00.456054 IP 116.203.215.57.18790 > 203.50.110.205.ntp:  [|ntp]
20:00:00.456284 IP 200.20.215.87.52640 > 203.50.96.51.domain: 60067[|domain]
20:00:00.456551 IP 133.24.215.78.3027 > 112.113.71.228.10972: UDP, length 37
20:00:00.456606 IP 203.50.96.51.domain > 200.20.215.87.52640: 60067 Refused-[|domain]
20:00:00.457647 IP 133.24.215.78.3027 > 125.74.131.96.5110: UDP, length 37
20:00:00.458193 IP 185.90.219.82.80 > 150.204.199.206.domain: 54501+ [1au][|domain]
20:00:00.458959 IP 133.24.215.78.3027 > 125.74.131.96.5110: UDP, length 38
20:00:00.459659 IP 133.24.215.78.3027 > 112.113.71.228.10972: UDP, length 37
20:00:00.459671 IP 133.24.215.78.3027 > 112.113.71.228.10972: UDP, length 37
20:00:00.459820 IP 47.164.138.168.7074 > 203.50.111.16.ntp:  [|ntp]
20:00:00.460237 IP 107.233.121.202.46147 > 203.50.109.226.ntp:  [|ntp]
20:00:00.460348 IP 202.139.239.243.53730 > 52.9.218.214.7361: UDP, length 93
20:00:00.460665 IP 163.162.113.19.64259 > 210.243.200.46.9000: UDP, length 44
20:00:00.460713 IP 103.217.155.20.55605 > 203.50.111.16.ntp:  [|ntp]
20:00:00.460859 IP 133.24.194.142.53922 > 192.67.28.246.8801: UDP, length 1116
20:00:00.461020 IP 116.203.215.57.35891 > 203.50.111.16.ntp:  [|ntp]
20:00:00.461214 IP 103.217.155.20.37822 > 203.50.111.16.ntp:  [|ntp]
20:00:00.461270 IP 133.24.194.142.53922 > 192.67.28.246.8801: UDP, length 1148
20:00:00.461627 IP 203.50.109.226.ntp > 107.233.121.202.46147:  [|ntp]
20:00:00.461676 IP 203.50.109.226.ntp > 107.233.121.202.46147:  [|ntp]
20:00:00.461677 IP 203.50.109.226.ntp > 107.233.121.202.46147:  [|ntp]
20:00:00.461702 IP 163.162.248.209.53017 > 107.15.13.55.30455: UDP, length 83
20:00:00.461706 IP 47.162.192.168.51986 > 203.50.111.16.ntp:  [|ntp]
20:00:00.461718 IP 203.50.109.226.ntp > 107.233.121.202.46147:  [|ntp]
20:00:00.461719 IP 203.50.109.226.ntp > 107.233.121.202.46147:  [|ntp]
20:00:00.461772 IP 203.50.109.226.ntp > 107.233.121.202.46147:  [|ntp]
20:00:00.461773 IP 203.50.109.226.ntp > 107.233.121.202.46147:  [|ntp]
20:00:00.461856 IP 203.50.109.226.ntp > 107.233.121.202.46147:  [|ntp]
20:00:00.461857 IP 203.50.109.226.ntp > 107.233.121.202.46147:  [|ntp]
20:00:00.461859 IP 203.50.109.226.ntp > 107.233.121.202.46147:  [|ntp]
20:00:00.461860 IP 203.50.109.226.ntp > 107.233.121.202.46147:  [|ntp]
20:00:00.461899 IP 203.50.109.226.ntp > 107.233.121.202.46147:  [|ntp]
20:00:00.461901 IP 203.50.109.226.ntp > 107.233.121.202.46147:  [|ntp]
20:00:00.461939 IP 203.50.109.226.ntp > 107.233.121.202.46147:  [|ntp]
20:00:00.461982 IP 203.50.109.226.ntp > 107.233.121.202.46147:  [|ntp]
20:00:00.461983 IP 203.50.109.226.ntp > 107.233.121.202.46147:  [|ntp]
20:00:00.461986 IP 203.50.109.226.ntp > 107.233.121.202.46147:  [|ntp]
20:00:00.462017 IP 203.50.109.226.ntp > 107.233.121.202.46147:  [|ntp]
20:00:00.462019 IP 203.50.109.226.ntp > 107.233.121.202.46147:  [|ntp]
20:00:00.462020 IP 203.50.109.226.ntp > 107.233.121.202.46147:  [|ntp]
20:00:00.462049 IP 203.50.109.226.ntp > 107.233.121.202.46147:  [|ntp]
20:00:00.462114 IP 203.50.109.226.ntp > 107.233.121.202.46147:  [|ntp]
20:00:00.462115 IP 203.50.109.226.ntp > 107.233.121.202.46147:  [|ntp]
20:00:00.462116 IP 203.50.109.226.ntp > 107.233.121.202.46147:  [|ntp]
20:00:00.462193 IP 203.50.109.226.ntp > 107.233.121.202.46147:  [|ntp]
20:00:00.462194 IP 203.50.109.226.ntp > 107.233.121.202.46147:  [|ntp]
20:00:00.462195 IP 203.50.109.226.ntp > 107.233.121.202.46147:  [|ntp]
20:00:00.462226 IP 203.50.109.226.ntp > 107.233.121.202.46147:  [|ntp]
20:00:00.462263 IP 203.50.109.226.ntp > 107.233.121.202.46147:  [|ntp]
20:00:00.462264 IP 203.50.109.226.ntp > 107.233.121.202.46147:  [|ntp]
20:00:00.462265 IP 203.50.109.226.ntp > 107.233.121.202.46147:  [|ntp]
20:00:00.462302 IP 203.50.109.226.ntp > 107.233.121.202.46147:  [|ntp]
20:00:00.462303 IP 203.50.109.226.ntp > 107.233.121.202.46147:  [|ntp]
20:00:00.462343 IP 203.50.109.226.ntp > 107.233.121.202.46147:  [|ntp]
20:00:00.462344 IP 203.50.109.226.ntp > 107.233.121.202.46147:  [|ntp]
20:00:00.462389 IP 203.50.109.226.ntp > 107.233.121.202.46147:  [|ntp]
20:00:00.462390 IP 203.50.109.226.ntp > 107.233.121.202.46147:  [|ntp]
20:00:00.462393 IP 203.50.109.226.ntp > 107.233.121.202.46147:  [|ntp]
20:00:00.462418 IP 103.217.155.20.55605 > 203.50.110.205.ntp:  [|ntp]
20:00:00.462478 IP 203.50.109.226.ntp > 107.233.121.202.46147:  [|ntp]
20:00:00.462480 IP 203.50.109.226.ntp > 107.233.121.202.46147:  [|ntp]
20:00:00.462481 IP 203.50.109.226.ntp > 107.233.121.202.46147:  [|ntp]
20:00:00.462482 IP 203.50.109.226.ntp > 107.233.121.202.46147:  [|ntp]
20:00:00.462569 IP 203.50.109.226.ntp > 107.233.121.202.46147:  [|ntp]
20:00:00.462570 IP 203.50.109.226.ntp > 107.233.121.202.46147:  [|ntp]
20:00:00.462571 IP 203.50.109.226.ntp > 107.233.121.202.46147:  [|ntp]
20:00:00.462572 IP 203.50.109.226.ntp > 107.233.121.202.46147:  [|ntp]
20:00:00.462621 IP 203.50.109.226.ntp > 107.233.121.202.46147:  [|ntp]
20:00:00.462657 IP 203.50.109.226.ntp > 107.233.121.202.46147:  [|ntp]
20:00:00.462659 IP 203.50.109.226.ntp > 107.233.121.202.46147:  [|ntp]
20:00:00.462660 IP 203.50.109.226.ntp > 107.233.121.202.46147:  [|ntp]
20:00:00.462698 IP 203.50.109.226.ntp > 107.233.121.202.46147:  [|ntp]
20:00:00.462699 IP 203.50.109.226.ntp > 107.233.121.202.46147:  [|ntp]
20:00:00.462740 IP 203.50.109.226.ntp > 107.233.121.202.46147:  [|ntp]
20:00:00.462741 IP 203.50.109.226.ntp > 107.233.121.202.46147:  [|ntp]
20:00:00.462743 IP 203.50.109.226.ntp > 107.233.121.202.46147:  [|ntp]
20:00:00.462996 IP 133.24.215.78.3027 > 125.74.131.96.5110: UDP, length 37
20:00:00.463429 IP 133.24.165.44.44061 > 68.109.102.32.12799: UDP, length 922
20:00:00.463826 IP 116.203.215.57.29212 > 203.50.110.205.ntp:  [|ntp]
20:00:00.464321 IP 133.24.165.44.44061 > 68.109.102.32.12799: UDP, length 922
20:00:00.464322 IP 23.152.219.111.domain > 163.162.158.154.16169: 23604*-[|domain]
20:00:00.464917 IP 185.160.228.249.49825 > 133.4.64.103.sunrpc: UDP, length 40
20:00:00.464959 IP 101.185.73.120.43171 > 203.50.110.205.ntp:  [|ntp]
20:00:00.465398 IP 185.90.219.82.80 > 150.204.99.71.domain: 54501+ [1au][|domain]
20:00:00.467071 IP 103.217.155.20.37070 > 203.50.111.16.ntp:  [|ntp]
20:00:00.467243 IP 133.24.165.44.44061 > 68.109.102.32.12799: UDP, length 900
20:00:00.467563 IP 58.178.138.104.8021 > 133.4.121.82.50356: UDP, length 20
20:00:00.467998 IP 116.203.215.57.23738 > 203.50.110.205.ntp:  [|ntp]
20:00:00.468034 IP 180.200.180.103.47767 > 203.50.111.16.ntp:  [|ntp]
20:00:00.468385 IP 103.240.69.37.30455 > 203.50.109.226.ntp:  [|ntp]
20:00:00.468596 IP 202.133.50.192.28303 > 54.235.226.115.4000: UDP, length 148
20:00:00.469946 IP 107.15.13.55.30455 > 163.162.248.209.53017: UDP, length 47
20:00:00.470664 IP 133.24.165.44.44061 > 68.109.102.32.12799: UDP, length 908
20:00:00.471052 IP 92.196.28.91.8718 > 163.162.145.19.sip: SIP
20:00:00.471053 IP 133.24.165.44.44061 > 68.109.102.32.12799: UDP, length 908
20:00:00.471332 IP 133.24.194.142.53922 > 192.67.28.246.8801: UDP, length 1175
20:00:00.471430 IP 133.24.165.44.44061 > 68.109.102.32.12799: UDP, length 906
20:00:00.471665 IP 133.24.194.142.49602 > 192.67.28.246.8801: UDP, length 214
20:00:00.472655 IP 180.200.180.103.61318 > 203.50.111.16.ntp:  [|ntp]
20:00:00.474063 IP 124.216.199.157.22926 > 203.50.109.231.ntp:  [|ntp]
20:00:00.474193 IP 122.147.154.181.5349 > 202.133.41.178.sunrpc: UDP, length 40
20:00:00.474263 IP 133.24.165.44.44061 > 68.109.102.32.12799: UDP, length 1076
20:00:00.474748 IP 133.24.165.44.44061 > 68.109.102.32.12799: UDP, length 1076
20:00:00.475141 IP 202.133.41.178.sunrpc > 122.147.154.181.5349: UDP, length 548
20:00:00.475203 IP 133.24.165.44.44061 > 68.109.102.32.12799: UDP, length 1076
20:00:00.475651 IP 47.164.138.168.57028 > 203.50.111.16.ntp:  [|ntp]
20:00:00.476309 IP 204.242.4.174.domain > 163.162.159.187.21345: 35387*-[|domain]
20:00:00.476837 IP 71.0.38.120.domain > 133.245.252.157.domain: 13551+[|domain]
20:00:00.477029 IP 116.203.215.57.32542 > 203.50.110.205.ntp:  [|ntp]
20:00:00.477079 IP 133.24.165.44.44061 > 68.109.102.32.12799: UDP, length 79
20:00:00.477824 IP 133.24.165.44.44061 > 68.109.102.32.12799: UDP, length 836
20:00:00.478242 IP 202.139.239.243.40096 > 18.28.79.198.42272: UDP, length 44
20:00:00.478307 IP 163.162.177.72.ipsec-nat-t > 126.31.146.18.49157: [|isakmp]
20:00:00.478410 IP 133.24.52.157.domain > 52.42.58.170.3371: 43058*-[|domain]
20:00:00.478461 IP 163.162.177.72.ipsec-nat-t > 126.31.146.18.49157: [|isakmp]
20:00:00.478464 IP 163.162.177.72.ipsec-nat-t > 126.31.146.18.49157: [|isakmp]
20:00:00.478466 IP 163.162.177.72.ipsec-nat-t > 126.31.146.18.49157: [|isakmp]
20:00:00.478467 IP 163.162.177.72.ipsec-nat-t > 126.31.146.18.49157: [|isakmp]
20:00:00.478472 IP 163.162.177.72.ipsec-nat-t > 126.31.146.18.49157: [|isakmp]
20:00:00.478590 IP 133.24.165.44.44061 > 68.109.102.32.12799: UDP, length 903
20:00:00.478783 IP 163.162.177.72.ipsec-nat-t > 126.31.146.18.49157: [|isakmp]
20:00:00.478859 IP 163.162.177.72.ipsec-nat-t > 126.31.146.18.49157: [|isakmp]
20:00:00.478860 IP 163.162.177.72.ipsec-nat-t > 126.31.146.18.49157: [|isakmp]
20:00:00.479395 IP 163.162.177.72.ipsec-nat-t > 126.31.146.18.49157: [|isakmp]
20:00:00.479588 IP 163.162.177.72.ipsec-nat-t > 126.31.146.18.49157: [|isakmp]
20:00:00.479590 IP 163.162.177.72.ipsec-nat-t > 126.31.146.18.49157: [|isakmp]
20:00:00.480681 IP 116.203.215.57.32542 > 203.50.111.16.ntp:  [|ntp]
20:00:00.481461 IP 116.203.215.57.54870 > 203.50.111.16.ntp:  [|ntp]
20:00:00.481597 IP 124.216.199.157.26209 > 203.50.109.226.ntp:  [|ntp]
20:00:00.482226 IP 133.24.194.142.53922 > 192.67.28.246.8801: UDP, length 1175
20:00:00.482228 IP 163.162.248.209.53017 > 107.15.13.55.30455: UDP, length 71
20:00:00.482335 IP 205.199.214.106.domain > 163.162.158.155.12637: 1525*-[|domain]
20:00:00.482381 IP 116.203.215.57.7080 > 203.50.111.16.ntp:  [|ntp]
20:00:00.483106 IP 133.24.165.44.44061 > 68.109.102.32.12799: UDP, length 80
20:00:00.483214 IP 121.233.28.226.4447 > 133.4.121.10.50348: UDP, length 104
20:00:00.483313 IP 122.147.154.181.64 > 202.133.41.178.sunrpc: UDP, length 40
20:00:00.484254 IP 116.203.215.57.5983 > 203.50.111.16.ntp:  [|ntp]
20:00:00.484902 IP 101.252.190.58.35415 > 203.50.109.226.ntp:  [|ntp]
20:00:00.485002 IP 163.162.114.57.50505 > 126.240.198.29.52333: UDP, length 316
20:00:00.485007 IP 180.94.82.70.52284 > 202.133.41.178.sunrpc: UDP, length 40
20:00:00.486014 IP 202.133.41.178.sunrpc > 180.94.82.70.52284: UDP, length 548
20:00:00.486235 IP 180.200.180.107.45253 > 203.50.111.16.ntp:  [|ntp]
20:00:00.486428 IP 203.50.109.226.ntp > 101.252.190.58.35415:  [|ntp]
20:00:00.486629 IP 203.50.109.226.ntp > 101.252.190.58.35415:  [|ntp]
20:00:00.486630 IP 203.50.109.226.ntp > 101.252.190.58.35415:  [|ntp]
20:00:00.486631 IP 203.50.109.226.ntp > 101.252.190.58.35415:  [|ntp]
20:00:00.486634 IP 203.50.109.226.ntp > 101.252.190.58.35415:  [|ntp]
20:00:00.486635 IP 203.50.109.226.ntp > 101.252.190.58.35415:  [|ntp]
20:00:00.486636 IP 203.50.109.226.ntp > 101.252.190.58.35415:  [|ntp]
20:00:00.486638 IP 203.50.109.226.ntp > 101.252.190.58.35415:  [|ntp]
20:00:00.486642 IP 203.50.109.226.ntp > 101.252.190.58.35415:  [|ntp]
20:00:00.486661 IP 203.50.109.226.ntp > 101.252.190.58.35415:  [|ntp]
20:00:00.486663 IP 103.217.155.20.37070 > 203.50.110.205.ntp:  [|ntp]
20:00:00.486720 IP 203.50.109.226.ntp > 101.252.190.58.35415:  [|ntp]
20:00:00.486754 IP 124.169.15.115.49689 > 133.245.164.255.netbios-ns: [|SMB]
20:00:00.486766 IP 180.200.180.103.47473 > 203.50.110.205.ntp:  [|ntp]
20:00:00.486768 IP 203.50.109.226.ntp > 101.252.190.58.35415:  [|ntp]
20:00:00.486818 IP 203.50.109.226.ntp > 101.252.190.58.35415:  [|ntp]
20:00:00.486819 IP 203.50.109.226.ntp > 101.252.190.58.35415:  [|ntp]
20:00:00.486823 IP 203.50.109.226.ntp > 101.252.190.58.35415:  [|ntp]
20:00:00.486824 IP 203.50.109.226.ntp > 101.252.190.58.35415:  [|ntp]
20:00:00.486827 IP 139.246.115.68.2419 > 203.50.111.16.ntp:  [|ntp]
20:00:00.486889 IP 203.50.109.226.ntp > 101.252.190.58.35415:  [|ntp]
20:00:00.486890 IP 203.50.109.226.ntp > 101.252.190.58.35415:  [|ntp]
20:00:00.486891 IP 203.50.109.226.ntp > 101.252.190.58.35415:  [|ntp]
20:00:00.486897 IP 101.185.73.120.3740 > 203.50.111.16.ntp:  [|ntp]
20:00:00.486921 IP 209.222.56.37.31420 > 163.162.99.237.3074: UDP, length 133
20:00:00.486923 IP 203.50.109.226.ntp > 101.252.190.58.35415:  [|ntp]
20:00:00.486924 IP 203.50.109.226.ntp > 101.252.190.58.35415:  [|ntp]
20:00:00.487119 IP 203.50.109.226.ntp > 101.252.190.58.35415:  [|ntp]
20:00:00.487122 IP 203.50.109.226.ntp > 101.252.190.58.35415:  [|ntp]
20:00:00.487123 IP 203.50.109.226.ntp > 101.252.190.58.35415:  [|ntp]
20:00:00.487125 IP 203.50.109.226.ntp > 101.252.190.58.35415:  [|ntp]
20:00:00.487127 IP 203.50.109.226.ntp > 101.252.190.58.35415:  [|ntp]
20:00:00.487128 IP 203.50.109.226.ntp > 101.252.190.58.35415:  [|ntp]
20:00:00.487129 IP 203.50.109.226.ntp > 101.252.190.58.35415:  [|ntp]
20:00:00.487130 IP 203.50.109.226.ntp > 101.252.190.58.35415:  [|ntp]
20:00:00.487223 IP 203.50.109.226.ntp > 101.252.190.58.35415:  [|ntp]
20:00:00.487224 IP 203.50.109.226.ntp > 101.252.190.58.35415:  [|ntp]
20:00:00.487225 IP 203.50.109.226.ntp > 101.252.190.58.35415:  [|ntp]
20:00:00.487226 IP 203.50.109.226.ntp > 101.252.190.58.35415:  [|ntp]
20:00:00.487227 IP 203.50.109.226.ntp > 101.252.190.58.35415:  [|ntp]
20:00:00.487288 IP 203.50.109.226.ntp > 101.252.190.58.35415:  [|ntp]
20:00:00.487289 IP 203.50.109.226.ntp > 101.252.190.58.35415:  [|ntp]
20:00:00.487290 IP 203.50.109.226.ntp > 101.252.190.58.35415:  [|ntp]
20:00:00.487291 IP 203.50.109.226.ntp > 101.252.190.58.35415:  [|ntp]
20:00:00.487359 IP 203.50.109.226.ntp > 101.252.190.58.35415:  [|ntp]
20:00:00.487361 IP 203.50.109.226.ntp > 101.252.190.58.35415:  [|ntp]
20:00:00.487396 IP 203.50.109.226.ntp > 101.252.190.58.35415:  [|ntp]
20:00:00.487397 IP 203.50.109.226.ntp > 101.252.190.58.35415:  [|ntp]
20:00:00.487399 IP 203.50.109.226.ntp > 101.252.190.58.35415:  [|ntp]
20:00:00.487443 IP 203.50.109.226.ntp > 101.252.190.58.35415:  [|ntp]
20:00:00.487444 IP 203.50.109.226.ntp > 101.252.190.58.35415:  [|ntp]
20:00:00.487445 IP 203.50.109.226.ntp > 101.252.190.58.35415:  [|ntp]
20:00:00.487482 IP 203.50.109.226.ntp > 101.252.190.58.35415:  [|ntp]
20:00:00.487483 IP 203.50.109.226.ntp > 101.252.190.58.35415:  [|ntp]
20:00:00.487514 IP 203.50.109.226.ntp > 101.252.190.58.35415:  [|ntp]
20:00:00.487556 IP 203.50.109.226.ntp > 101.252.190.58.35415:  [|ntp]
20:00:00.487557 IP 203.50.109.226.ntp > 101.252.190.58.35415:  [|ntp]
20:00:00.487558 IP 203.50.109.226.ntp > 101.252.190.58.35415:  [|ntp]
20:00:00.487617 IP 47.162.192.168.41384 > 203.50.111.16.ntp:  [|ntp]
20:00:00.487697 IP 126.240.198.29.52333 > 163.162.248.136.59764: UDP, length 204
20:00:00.488937 IP 116.203.215.57.43579 > 203.50.111.16.ntp:  [|ntp]
20:00:00.489003 IP 122.147.154.181.27890 > 202.133.41.178.sunrpc: UDP, length 40
20:00:00.489761 IP 139.246.115.68.57113 > 203.50.110.205.ntp:  [|ntp]
20:00:00.489864 IP 203.50.106.122.16988 > 192.193.84.188.domain: 61027% [1au][|domain]
20:00:00.489945 IP 203.50.106.122.17208 > 192.193.84.188.domain: 10658 [1au][|domain]
20:00:00.489946 IP 203.50.106.122.54720 > 192.193.84.188.domain: 1800% [1au][|domain]
20:00:00.489960 IP 203.50.106.122.22059 > 192.193.84.188.domain: 45187% [1au][|domain]
20:00:00.489968 IP 203.50.106.122.61206 > 192.193.84.188.domain: 58881% [1au][|domain]
20:00:00.490038 IP 203.50.106.122.34274 > 192.193.84.188.domain: 33903% [1au][|domain]
20:00:00.490041 IP 120.129.203.184.57441 > 203.50.109.226.ntp:  [|ntp]
20:00:00.490129 IP 202.133.41.178.sunrpc > 122.147.154.181.27890: UDP, length 548
20:00:00.490133 IP 203.50.106.122.54582 > 192.193.84.188.domain: 29567% [1au][|domain]
20:00:00.490133 IP 180.200.180.107.45253 > 203.50.110.205.ntp:  [|ntp]
20:00:00.490138 IP 103.217.155.20.22534 > 203.50.111.16.ntp:  [|ntp]
20:00:00.490141 IP 133.24.248.219.59711 > 38.153.237.74.domain: 42534% [1au][|domain]
20:00:00.490318 IP 47.164.138.168.45871 > 203.50.111.16.ntp:  [|ntp]
20:00:00.490585 IP 47.162.192.168.41384 > 203.50.110.205.ntp:  [|ntp]
20:00:00.490917 IP 133.24.194.142.53922 > 192.67.28.246.8801: UDP, length 1206
20:00:00.491202 IP 133.24.194.142.49602 > 192.67.28.246.8801: UDP, length 205
20:00:00.491303 IP 133.24.52.157.domain > 52.234.180.161.32138: 53004*-[|domain]
20:00:00.491380 IP 133.24.165.44.44061 > 68.109.102.32.12799: UDP, length 79
20:00:00.491951 IP 203.50.109.231.ntp > 107.233.121.202.37387:  [|ntp]
20:00:00.491952 IP 203.50.109.231.ntp > 107.233.121.202.37387:  [|ntp]
20:00:00.491954 IP 203.50.109.231.ntp > 107.233.121.202.37387:  [|ntp]
20:00:00.491959 IP 203.50.109.231.ntp > 107.233.121.202.37387:  [|ntp]
20:00:00.491960 IP 203.50.109.231.ntp > 107.233.121.202.37387:  [|ntp]
20:00:00.491961 IP 203.50.109.231.ntp > 107.233.121.202.37387:  [|ntp]
20:00:00.491962 IP 203.50.109.231.ntp > 107.233.121.202.37387:  [|ntp]
20:00:00.491964 IP 203.50.109.231.ntp > 107.233.121.202.37387:  [|ntp]
20:00:00.491965 IP 203.50.109.231.ntp > 107.233.121.202.37387:  [|ntp]
20:00:00.491967 IP 203.50.109.231.ntp > 107.233.121.202.37387:  [|ntp]
20:00:00.491968 IP 203.50.109.231.ntp > 107.233.121.202.37387:  [|ntp]
20:00:00.491969 IP 203.50.109.231.ntp > 107.233.121.202.37387:  [|ntp]
20:00:00.491976 IP 203.50.109.231.ntp > 107.233.121.202.37387:  [|ntp]
20:00:00.492047 IP 203.50.109.231.ntp > 107.233.121.202.37387:  [|ntp]
20:00:00.492049 IP 203.50.109.231.ntp > 107.233.121.202.37387:  [|ntp]
20:00:00.492050 IP 203.50.109.231.ntp > 107.233.121.202.37387:  [|ntp]
20:00:00.492051 IP 203.50.109.231.ntp > 107.233.121.202.37387:  [|ntp]
20:00:00.492052 IP 203.50.109.231.ntp > 107.233.121.202.37387:  [|ntp]
20:00:00.492065 IP 182.222.208.51.domain > 163.162.158.152.46615: 56014*-[|domain]
20:00:00.492131 IP 203.50.109.231.ntp > 107.233.121.202.37387:  [|ntp]
