20:00:00.387717 IP6 2a03:9660:8c06:c136:89cd:37c3:e3e0:2202.https > 2001:dd70:3e3f:debd:662a:5e15:f3e7:a5e8.51492: Flags [P.], seq 840176819:840178217, ack 2229863000, win 131, options [nop,nop,TS val 3436220385 ecr 918303345], length 1398
20:00:00.387721 IP6 2a03:9660:8c06:c136:89cd:37c3:e3e0:2202.https > 2001:dd70:3e3f:debd:662a:5e15:f3e7:a5e8.51492: Flags [.], seq 1398:2796, ack 1, win 131, options [nop,nop,TS val 3436220385 ecr 918303346], length 1398
20:00:00.387787 IP6 2a03:9660:8ff1:478f:7832:b044:2300:8031.https > 2001:dd70:3e3f:dea8:5dd:626f:7cc3:6b7a.63285: Flags [P.], seq 1950965145:1950966543, ack 473993237, win 579, options [nop,nop,TS val 2403127468 ecr 1001628367], length 1398
20:00:00.387854 IP6 2a03:9660:8c06:c136:89cd:37c3:e3e0:2202.https > 2001:dd70:3e3f:debb:d786:d0dd:9315:2bbf.65334: Flags [P.], seq 194927861:194929259, ack 2563378179, win 122, options [nop,nop,TS val 1821317406 ecr 1069644000], length 1398
20:00:00.387857 IP6 2a03:9660:8c06:c136:89cd:37c3:e3e0:2202.https > 2001:dd70:3e3f:debb:d786:d0dd:9315:2bbf.65334: Flags [P.], seq 1398:2796, ack 1, win 122, options [nop,nop,TS val 1821317406 ecr 1069644000], length 1398
20:00:00.388006 IP6 2a03:9660:8c06:c136:89cd:37c3:e3e0:2202.https > 2001:dd70:3e3f:debd:662a:5e15:f3e7:a5e8.51492: Flags [P.], seq 2796:4194, ack 1, win 131, options [nop,nop,TS val 3436220386 ecr 918303350], length 1398
20:00:00.388055 IP6 2a03:9660:8c06:c136:89cd:37c3:e3e0:2202.https > 2001:dd70:3e3f:debb:d786:d0dd:9315:2bbf.65334: Flags [P.], seq 2796:4194, ack 1, win 122, options [nop,nop,TS val 1821317406 ecr 1069644001], length 1398
20:00:00.388171 IP6 2a03:9660:8ff1:478f:7832:b044:2300:8031.https > 2001:dd70:3e3f:dea8:5dd:626f:7cc3:6b7a.63285: Flags [P.], seq 1398:2796, ack 1, win 579, options [nop,nop,TS val 2403127469 ecr 1001628367], length 1398
20:00:00.388364 IP6 2a03:9660:8c06:c136:89cd:37c3:e3e0:2202.https > 2001:dd70:3e3f:debd:662a:5e15:f3e7:a5e8.51492: Flags [P.], seq 4194:5592, ack 1, win 131, options [nop,nop,TS val 3436220386 ecr 918303352], length 1398
20:00:00.388439 IP6 2a03:9660:8ff1:478f:7832:b044:2300:8031.https > 2001:dd70:3e3f:dea8:5dd:626f:7cc3:6b7a.63285: Flags [P.], seq 2796:4194, ack 1, win 579, options [nop,nop,TS val 2403127469 ecr 1001628368], length 1398
20:00:00.388530 IP6 2a03:9660:8c06:c136:89cd:37c3:e3e0:2202.https > 2001:dd70:3e3f:debb:d786:d0dd:9315:2bbf.65334: Flags [P.], seq 4194:5592, ack 1, win 122, options [nop,nop,TS val 1821317407 ecr 1069644001], length 1398
20:00:00.388630 IP6 2403:5cf8:c58e:f6c0:ff01:fff1:fc1f:8031.https > 2001:dd70:3e60:24f9:b204:93f7:9a2f:72ff.62631: Flags [.], ack 1127322309, win 926, options [nop,nop,TS val 415956548 ecr 1259826853], length 0
20:00:00.388717 IP6 2a03:9660:8c06:c136:89cd:37c3:e3e0:2202.https > 2001:dd70:3e3f:debb:d786:d0dd:9315:2bbf.65334: Flags [P.], seq 5592:6990, ack 1, win 122, options [nop,nop,TS val 1821317407 ecr 1069644002], length 1398
20:00:00.388717 IP6 2a03:9660:8c06:c136:89cd:37c3:e3e0:2202.https > 2001:dd70:3e3f:debb:d786:d0dd:9315:2bbf.65334: Flags [P.], seq 6990:8388, ack 1, win 122, options [nop,nop,TS val 1821317407 ecr 1069644002], length 1398
20:00:00.388723 IP6 2a03:9660:8c06:c136:89cd:37c3:e3e0:2202.https > 2001:dd70:3e3f:debb:d786:d0dd:9315:2bbf.65334: Flags [P.], seq 8388:9786, ack 1, win 122, options [nop,nop,TS val 1821317408 ecr 1069644002], length 1398
20:00:00.388735 IP6 2a03:9660:8c06:c136:89cd:37c3:e3e0:2202.https > 2001:dd70:3e3f:debd:662a:5e15:f3e7:a5e8.51492: Flags [.], seq 5592:6990, ack 1, win 131, options [nop,nop,TS val 3436220387 ecr 918303353], length 1398
20:00:00.389264 IP6 2a03:9660:8c06:c136:89cd:37c3:e3e0:2202.https > 2001:dd70:3e3f:debb:d786:d0dd:9315:2bbf.65334: Flags [P.], seq 9786:11184, ack 1, win 122, options [nop,nop,TS val 1821317408 ecr 1069644003], length 1398
20:00:00.389535 IP6 2a03:9660:8c06:c136:89cd:37c3:e3e0:2202.https > 2001:dd70:3e3f:debb:d786:d0dd:9315:2bbf.65334: Flags [P.], seq 11184:12582, ack 1, win 122, options [nop,nop,TS val 1821317408 ecr 1069644003], length 1398
20:00:00.389831 IP6 2001:dd70:3ff3:2c27:6c0:bd85:60f6:614b.24374 > 2a01:ef56:e00d:7e41:f8b6:9b3:fce3:1faf.http: Flags [.], ack 253405495, win 3724, length 0
20:00:00.390009 IP6 2001:dbf8:f01b:8576:7b9:ee41:e31c:7f0e > 2001:dd67:e003:dff1:441:efce:3fc:9f3d: IP 208.133.135.89 > 192.212.107.60: ICMP echo request, id 8, seq 23117, length 20
20:00:00.390046 IP6 2001:d407:1fc:7946:f8b9:e1bd:4008:a20f > 2001:dd70:3ff3:61b2:ff0f:e7b1:c900:81e2: ICMP6, echo reply, seq 40, length 56
20:00:00.390428 IP6 2a02:3477:cd42:8730:fc07:ee31:3c70:ecf1.http > 2001:dd70:3e3f:df51:6314:13f6:efa4:6a75.51476: Flags [.], ack 3495745827, win 31, length 0
20:00:00.390429 IP6 2001:dbf8:f01b:8576:7b9:ee41:e31c:7f0e > 2001:dd67:e003:dff1:441:efce:3fc:9f3d: IP 208.133.135.89 > 192.212.107.60: ICMP echo request, id 8, seq 19167, length 20
20:00:00.390444 IP6 2606:1068:cd80:7bfc:ff4:f1ac:1937:83e.https > 2001:dd70:3ea8:f82f:8d6f:f5d8:d9f5:2de5.62873: Flags [P.], seq 54369609:54370264, ack 1179197820, win 249, length 655
20:00:00.390445 IP6 2606:1068:cd80:7bfc:ff4:f1ac:1937:83e.https > 2001:dd70:3ea8:f82f:8d6f:f5d8:d9f5:2de5.62873: Flags [P.], seq 655:900, ack 1, win 249, length 245
20:00:00.390551 IP6 2601:5998:c3f3:d68a:3d4c:350c:9acf:7d7f.50030 > 2001:dd70:3bfd:6af:f872:44e7:fb3:d999.http: Flags [.], ack 579875381, win 65520, options [nop,nop,sack 1 {2049:146433}], length 0
20:00:00.390552 IP6 2601:5998:c3f3:d68a:3d4c:350c:9acf:7d7f.50030 > 2001:dd70:3bfd:6af:f872:44e7:fb3:d999.http: Flags [.], ack 1, win 65520, options [nop,nop,sack 1 {2049:147457}], length 0
20:00:00.390612 IP6 2a03:9660:8c06:c136:89cd:37c3:e3e0:2202.https > 2001:dd70:3e3f:debb:d786:d0dd:9315:2bbf.65334: Flags [.], seq 12582:13980, ack 1, win 122, options [nop,nop,TS val 1821317410 ecr 1069644004], length 1398
20:00:00.390616 IP6 2a03:9660:8c06:c136:89cd:37c3:e3e0:2202.https > 2001:dd70:3e3f:debb:d786:d0dd:9315:2bbf.65334: Flags [P.], seq 13980:15378, ack 1, win 122, options [nop,nop,TS val 1821317410 ecr 1069644004], length 1398
20:00:00.390617 IP6 2a03:9660:8c06:c136:89cd:37c3:e3e0:2202.https > 2001:dd70:3e3f:debb:d786:d0dd:9315:2bbf.65334: Flags [P.], seq 15378:16776, ack 1, win 122, options [nop,nop,TS val 1821317410 ecr 1069644005], length 1398
20:00:00.390886 IP6 2a03:9660:8c06:c136:89cd:37c3:e3e0:2202.https > 2001:dd70:3e3f:debb:d786:d0dd:9315:2bbf.65334: Flags [P.], seq 16776:18174, ack 1, win 122, options [nop,nop,TS val 1821317411 ecr 1069644005], length 1398
20:00:00.391315 IP6 2403:5cf8:c58e:f6c0:ff01:fff1:fc1f:8031.https > 2001:dd70:3e60:24f9:b204:93f7:9a2f:72ff.62631: Flags [P.], seq 0:51, ack 46, win 926, options [nop,nop,TS val 415956552 ecr 1259826853], length 51
20:00:00.391542 IP6 2a03:9660:8c06:c136:89cd:37c3:e3e0:2202.https > 2001:dd70:3e3f:debb:d786:d0dd:9315:2bbf.65334: Flags [P.], seq 18174:19572, ack 1, win 122, options [nop,nop,TS val 1821317411 ecr 1069644006], length 1398
20:00:00.392034 IP6 2a03:9660:8c06:c136:89cd:37c3:e3e0:2202.https > 2001:dd70:3e3f:debb:d786:d0dd:9315:2bbf.65334: Flags [.], seq 19572:20970, ack 1, win 122, options [nop,nop,TS val 1821317411 ecr 1069644006], length 1398
20:00:00.392079 IP6 2001:c637:3d19:f976:f8ce:186b:c0e1:7fc9.rsync > 2001:dd70:3ff3:70c6:fb0f:f9bc:3c1c:73ec.50456: Flags [.], seq 705906868:705908296, ack 1381491540, win 2828, options [nop,nop,TS val 1695041325 ecr 771515321], length 1428
20:00:00.392080 IP6 2001:c637:3d19:f976:f8ce:186b:c0e1:7fc9.rsync > 2001:dd70:3ff3:70c6:fb0f:f9bc:3c1c:73ec.50456: Flags [.], seq 1428:2856, ack 1, win 2828, options [nop,nop,TS val 1695041325 ecr 771515321], length 1428
20:00:00.392393 IP6 2a03:9660:8c06:c136:89cd:37c3:e3e0:2202.https > 2001:dd70:3e3f:debb:d786:d0dd:9315:2bbf.65334: Flags [.], seq 20970:22368, ack 1, win 122, options [nop,nop,TS val 1821317412 ecr 1069644008], length 1398
20:00:00.392394 IP6 2a03:9660:8c06:c136:89cd:37c3:e3e0:2202.https > 2001:dd70:3e3f:debb:d786:d0dd:9315:2bbf.65334: Flags [P.], seq 22368:23766, ack 1, win 122, options [nop,nop,TS val 1821317412 ecr 1069644008], length 1398
20:00:00.392648 IP6 2a03:9660:8c06:c136:89cd:37c3:e3e0:2202.https > 2001:dd70:3e3f:debb:d786:d0dd:9315:2bbf.65334: Flags [P.], seq 23766:25164, ack 1, win 122, options [nop,nop,TS val 1821317412 ecr 1069644009], length 1398
20:00:00.392816 IP6 2a03:9660:8c06:c136:89cd:37c3:e3e0:2202.https > 2001:dd70:3e3f:debb:d786:d0dd:9315:2bbf.65334: Flags [P.], seq 25164:26562, ack 1, win 122, options [nop,nop,TS val 1821317412 ecr 1069644010], length 1398
20:00:00.393201 IP6 2a03:9660:8c06:c136:89cd:37c3:e3e0:2202.https > 2001:dd70:3e3f:debb:d786:d0dd:9315:2bbf.65334: Flags [P.], seq 26562:27960, ack 1, win 122, options [nop,nop,TS val 1821317413 ecr 1069644010], length 1398
20:00:00.393279 IP6 2001:dd67:e003:dff1:441:efce:3fc:9f3f > 2001:dd70:3e3f:e6ff:3f:f983:c3fb:e30e: ICMP6, time exceeded in-transit[|icmp6]
20:00:00.394014 IP6 2a03:9660:8c06:c136:89cd:37c3:e3e0:2202.https > 2001:dd70:3e3f:debb:d786:d0dd:9315:2bbf.65334: Flags [P.], seq 27960:29358, ack 1, win 122, options [nop,nop,TS val 1821317414 ecr 1069644011], length 1398
20:00:00.394432 IP6 2a03:9660:8e19:3e8c:4bc2:c9f4:20e3:5a45.https > 2001:dd70:3ea8:f82a:7920:1770:180:b9d5.58866: Flags [.], ack 509355906, win 115, length 0
20:00:00.394664 IP6 2a03:9660:8e19:3e8c:4bc2:c9f4:20e3:5a45.https > 2001:dd70:3ea8:f82a:7920:1770:180:b9d5.58865: Flags [.], ack 2990809953, win 115, length 0
20:00:00.394779 IP6 2a03:9660:8c06:c136:89cd:37c3:e3e0:2202.https > 2001:dd70:3e3f:debb:d786:d0dd:9315:2bbf.65334: Flags [P.], seq 29358:30756, ack 1, win 122, options [nop,nop,TS val 1821317414 ecr 1069644012], length 1398
20:00:00.394864 IP6 2a03:9660:8c06:c136:89cd:37c3:e3e0:2202.https > 2001:dd70:3e3f:debb:d786:d0dd:9315:2bbf.65334: Flags [P.], seq 30756:32154, ack 1, win 122, options [nop,nop,TS val 1821317415 ecr 1069644013], length 1398
20:00:00.395035 IP6 2a03:9660:8e19:3e8c:4bc2:c9f4:20e3:5a45.https > 2001:dd70:3ea8:f82a:7920:1770:180:b9d5.58866: Flags [.], seq 0:1410, ack 1, win 115, length 1410
20:00:00.395036 IP6 2a03:9660:8e19:3e8c:4bc2:c9f4:20e3:5a45.https > 2001:dd70:3ea8:f82a:7920:1770:180:b9d5.58866: Flags [.], seq 1410:2820, ack 1, win 115, length 1410
20:00:00.395055 IP6 2a03:9660:8c06:c136:89cd:37c3:e3e0:2202.https > 2001:dd70:3e3f:debb:d786:d0dd:9315:2bbf.65334: Flags [P.], seq 32154:33552, ack 1, win 122, options [nop,nop,TS val 1821317415 ecr 1069644013], length 1398
20:00:00.395103 IP6 2a03:9660:8c06:c136:89cd:37c3:e3e0:2202.https > 2001:dd70:3e3f:debb:d786:d0dd:9315:2bbf.65334: Flags [P.], seq 33552:34950, ack 1, win 122, options [nop,nop,TS val 1821317415 ecr 1069644014], length 1398
20:00:00.395214 IP6 2a03:9660:8e19:3e8c:4bc2:c9f4:20e3:5a45.https > 2001:dd70:3ea8:f82a:7920:1770:180:b9d5.58865: Flags [.], seq 0:1410, ack 1, win 115, length 1410
20:00:00.395241 IP6 2a03:9660:8e19:3e8c:4bc2:c9f4:20e3:5a45.https > 2001:dd70:3ea8:f82a:7920:1770:180:b9d5.58865: Flags [.], seq 1410:2820, ack 1, win 115, length 1410
20:00:00.395242 IP6 2a03:9660:8e19:3e8c:4bc2:c9f4:20e3:5a45.https > 2001:dd70:3ea8:f82a:7920:1770:180:b9d5.58865: Flags [P.], seq 2820:3487, ack 1, win 115, length 667
20:00:00.395305 IP6 2001:bfcf:ffc:f860:f806:f67e:23e0:801e.6881 > 2001:dd70:3638:1fef:2aa:3d07:feab:4041.41750: UDP, length 372
20:00:00.395670 IP6 2001:dd70:3ff3:2c27:6c0:bd85:60f6:614b.24374 > 2a01:ef56:e00d:7e41:f8b6:9b3:fce3:1faf.http: Flags [.], ack 1441, win 3724, length 0
20:00:00.395791 IP6 2001:dd70:3ff3:2c27:6c0:bd85:60f6:614b.24374 > 2a01:ef56:e00d:7e41:f8b6:9b3:fce3:1faf.http: Flags [.], ack 4321, win 3724, length 0
20:00:00.395792 IP6 2001:dd70:3ff3:2c27:6c0:bd85:60f6:614b.24374 > 2a01:ef56:e00d:7e41:f8b6:9b3:fce3:1faf.http: Flags [.], ack 7201, win 3724, length 0
20:00:00.395827 IP6 2601:5998:c3f3:d68a:3d4c:350c:9acf:7d7f.50030 > 2001:dd70:3bfd:6af:f872:44e7:fb3:d999.http: Flags [.], ack 1, win 65520, options [nop,nop,sack 1 {2049:148481}], length 0
20:00:00.395828 IP6 2601:5998:c3f3:d68a:3d4c:350c:9acf:7d7f.50030 > 2001:dd70:3bfd:6af:f872:44e7:fb3:d999.http: Flags [.], ack 1, win 65520, options [nop,nop,sack 1 {2049:149505}], length 0
20:00:00.395829 IP6 2601:5998:c3f3:d68a:3d4c:350c:9acf:7d7f.50030 > 2001:dd70:3bfd:6af:f872:44e7:fb3:d999.http: Flags [.], ack 1, win 65520, options [nop,nop,sack 1 {2049:150529}], length 0
20:00:00.395831 IP6 2601:5998:c3f3:d68a:3d4c:350c:9acf:7d7f.50030 > 2001:dd70:3bfd:6af:f872:44e7:fb3:d999.http: Flags [.], ack 1, win 65520, options [nop,nop,sack 1 {2049:151553}], length 0
20:00:00.395832 IP6 2601:5998:c3f3:d68a:3d4c:350c:9acf:7d7f.50030 > 2001:dd70:3bfd:6af:f872:44e7:fb3:d999.http: Flags [.], ack 1, win 65520, options [nop,nop,sack 1 {2049:152577}], length 0
20:00:00.395834 IP6 2601:5998:c3f3:d68a:3d4c:350c:9acf:7d7f.50030 > 2001:dd70:3bfd:6af:f872:44e7:fb3:d999.http: Flags [.], ack 1, win 65520, options [nop,nop,sack 1 {2049:153601}], length 0
20:00:00.395835 IP6 2601:5998:c3f3:d68a:3d4c:350c:9acf:7d7f.50030 > 2001:dd70:3bfd:6af:f872:44e7:fb3:d999.http: Flags [.], ack 1, win 65520, options [nop,nop,sack 1 {2049:154625}], length 0
20:00:00.395836 IP6 2601:5998:c3f3:d68a:3d4c:350c:9acf:7d7f.50030 > 2001:dd70:3bfd:6af:f872:44e7:fb3:d999.http: Flags [.], ack 1, win 65520, options [nop,nop,sack 1 {2049:155649}], length 0
20:00:00.395837 IP6 2601:5998:c3f3:d68a:3d4c:350c:9acf:7d7f.50030 > 2001:dd70:3bfd:6af:f872:44e7:fb3:d999.http: Flags [.], ack 1, win 65520, options [nop,nop,sack 1 {2049:156673}], length 0
20:00:00.395838 IP6 2601:5998:c3f3:d68a:3d4c:350c:9acf:7d7f.50030 > 2001:dd70:3bfd:6af:f872:44e7:fb3:d999.http: Flags [.], ack 1, win 65520, options [nop,nop,sack 1 {2049:157697}], length 0
20:00:00.395992 IP6 2001:dd70:3ff3:2c27:6c0:bd85:60f6:614b.24374 > 2a01:ef56:e00d:7e41:f8b6:9b3:fce3:1faf.http: Flags [.], ack 10081, win 3724, length 0
20:00:00.395993 IP6 2001:dd70:3ff3:2c27:6c0:bd85:60f6:614b.24374 > 2a01:ef56:e00d:7e41:f8b6:9b3:fce3:1faf.http: Flags [.], ack 12961, win 3724, length 0
20:00:00.396044 IP6 2a03:9660:8e19:3e8c:4bc2:c9f4:20e3:5a45.https > 2001:dd70:3e60:80d1:8bbe:a55c:e6f:a121.65469: Flags [P.], seq 4001330909:4001330951, ack 3801198080, win 564, options [nop,nop,TS val 2000731597 ecr 758948823], length 42
20:00:00.396047 IP6 2a03:9660:8ff1:478f:7832:b044:2300:8031.https > 2001:dd70:3e3f:dea8:5dd:626f:7cc3:6b7a.63285: Flags [P.], seq 4194:5592, ack 1, win 579, options [nop,nop,TS val 2403127478 ecr 1001628368], length 1398
20:00:00.396336 IP6 2a03:9660:8c06:c136:89cd:37c3:e3e0:2202.https > 2001:dd70:3e3f:debb:d786:d0dd:9315:2bbf.65334: Flags [P.], seq 34950:36348, ack 1, win 122, options [nop,nop,TS val 1821317416 ecr 1069644015], length 1398
20:00:00.396338 IP6 2a03:9660:8c06:c136:89cd:37c3:e3e0:2202.https > 2001:dd70:3e3f:debb:d786:d0dd:9315:2bbf.65334: Flags [P.], seq 36348:37746, ack 1, win 122, options [nop,nop,TS val 1821317416 ecr 1069644015], length 1398
20:00:00.397692 IP6 2a03:9660:8c06:c136:89cd:37c3:e3e0:2202.https > 2001:dd70:3e3f:debb:d786:d0dd:9315:2bbf.65334: Flags [P.], seq 37746:39144, ack 1, win 122, options [nop,nop,TS val 1821317417 ecr 1069644015], length 1398
20:00:00.397733 IP6 2403:5cf8:c58e:f8cd:34e:11cc:3ff:e019.https > 2001:dd70:3e3f:dead:66c6:68ad:b888:18b9.51814: Flags [S.], seq 330424653, ack 1107544550, win 28560, options [mss 1440,nop,nop,TS val 1625114654 ecr 940247002,nop,wscale 5], length 0
20:00:00.397847 IP6 2a03:9660:8ff1:478f:7832:b044:2300:8031.https > 2001:dd70:3e3f:dea8:5dd:626f:7cc3:6b7a.63298: Flags [.], seq 3890112677:3890114075, ack 1397249566, win 227, options [nop,nop,TS val 2306706957 ecr 1001628370], length 1398
20:00:00.398056 IP6 2a03:9660:8c06:c136:89cd:37c3:e3e0:2202.https > 2001:dd70:3e3f:debb:d786:d0dd:9315:2bbf.65334: Flags [P.], seq 39144:40542, ack 1, win 122, options [nop,nop,TS val 1821317418 ecr 1069644015], length 1398
20:00:00.398059 IP6 2a03:9660:8c06:c136:89cd:37c3:e3e0:2202.https > 2001:dd70:3e3f:debb:d786:d0dd:9315:2bbf.65334: Flags [P.], seq 40542:41940, ack 1, win 122, options [nop,nop,TS val 1821317418 ecr 1069644016], length 1398
20:00:00.398083 IP6 2a03:9660:8ff1:4793:c8c2:cfb5:dc03:972c.https > 2001:dd70:3e3f:dea8:ca00:3af9:a8bc:ec8e.49853: Flags [.], seq 3255627706:3255629104, ack 2903887650, win 223, options [nop,nop,TS val 2480309582 ecr 627380153], length 1398
20:00:00.398084 IP6 2a03:9660:8ff1:4793:c8c2:cfb5:dc03:972c.https > 2001:dd70:3e3f:dea8:ca00:3af9:a8bc:ec8e.49853: Flags [.], seq 1398:2796, ack 1, win 223, options [nop,nop,TS val 2480309582 ecr 627380153], length 1398
20:00:00.398085 IP6 2a03:9660:8ff1:4793:c8c2:cfb5:dc03:972c.https > 2001:dd70:3e3f:dea8:ca00:3af9:a8bc:ec8e.49853: Flags [.], seq 2796:4194, ack 1, win 223, options [nop,nop,TS val 2480309582 ecr 627380153], length 1398
20:00:00.398087 IP6 2a03:9660:8ff1:4793:c8c2:cfb5:dc03:972c.https > 2001:dd70:3e3f:dea8:ca00:3af9:a8bc:ec8e.49853: Flags [.], seq 4194:5592, ack 1, win 223, options [nop,nop,TS val 2480309582 ecr 627380153], length 1398
20:00:00.398204 IP6 2a03:9660:8c06:c136:89cd:37c3:e3e0:2202.https > 2001:dd70:3e3f:debb:d786:d0dd:9315:2bbf.65334: Flags [.], seq 41940:43338, ack 1, win 122, options [nop,nop,TS val 1821317418 ecr 1069644016], length 1398
20:00:00.398250 IP6 2a03:9660:8ff1:4793:c8c2:cfb5:dc03:972c.https > 2001:dd70:3e3f:dea8:ca00:3af9:a8bc:ec8e.49853: Flags [.], seq 5592:6990, ack 1, win 223, options [nop,nop,TS val 2480309582 ecr 627380153], length 1398
20:00:00.398252 IP6 2a03:9660:8ff1:4793:c8c2:cfb5:dc03:972c.https > 2001:dd70:3e3f:dea8:ca00:3af9:a8bc:ec8e.49853: Flags [P.], seq 6990:8096, ack 1, win 223, options [nop,nop,TS val 2480309582 ecr 627380153], length 1106
20:00:00.398398 IP6 2a03:9660:8c06:c136:89cd:37c3:e3e0:2202.https > 2001:dd70:3e3f:debb:d786:d0dd:9315:2bbf.65334: Flags [P.], seq 43338:44736, ack 1, win 122, options [nop,nop,TS val 1821317419 ecr 1069644016], length 1398
20:00:00.398448 IP6 2606:1068:cd80:7bfc:ff4:f1ac:1937:83e.https > 2001:dd70:3ea8:f82a:9371:7c7a:c720:63d7.52187: Flags [P.], seq 1242939578:1242940233, ack 3366860683, win 130, length 655
20:00:00.398449 IP6 2606:1068:cd80:7bfc:ff4:f1ac:1937:83e.https > 2001:dd70:3ea8:f82a:9371:7c7a:c720:63d7.52187: Flags [P.], seq 655:900, ack 1, win 130, length 245
20:00:00.398782 IP6 2a03:9660:8ff1:478f:7832:b044:2300:8031.https > 2001:dd70:3e3f:dea8:1817:e9b1:81b7:fd22.49981: Flags [P.], seq 2075117991:2075118036, ack 4137541900, win 2043, options [nop,nop,TS val 1821394230 ecr 43965549], length 45
20:00:00.399005 IP6 2a03:9660:8ff1:478f:7832:b044:2300:8031.https > 2001:dd70:3e3f:dea8:1817:e9b1:81b7:fd22.49981: Flags [P.], seq 45:90, ack 549, win 2043, options [nop,nop,TS val 1821394230 ecr 43965550], length 45
20:00:00.399573 IP6 2a03:9660:8ff1:478f:7832:b044:2300:8031.https > 2001:dd70:3e3f:dea8:1817:e9b1:81b7:fd22.49981: Flags [P.], seq 951:2298, ack 549, win 2043, options [nop,nop,TS val 1821394231 ecr 43965550], length 1347
20:00:00.400130 IP6 2601:5998:c3f3:d68a:3d4c:350c:9acf:7d7f.50030 > 2001:dd70:3bfd:6af:f872:44e7:fb3:d999.http: Flags [.], ack 1, win 65520, options [nop,nop,sack 1 {2049:158721}], length 0
20:00:00.400142 IP6 2601:5998:c3f3:d68a:3d4c:350c:9acf:7d7f.50030 > 2001:dd70:3bfd:6af:f872:44e7:fb3:d999.http: Flags [.], ack 1, win 65520, options [nop,nop,sack 1 {2049:159745}], length 0
20:00:00.400143 IP6 2601:5998:c3f3:d68a:3d4c:350c:9acf:7d7f.50030 > 2001:dd70:3bfd:6af:f872:44e7:fb3:d999.http: Flags [.], ack 1, win 65520, options [nop,nop,sack 1 {2049:160769}], length 0
20:00:00.400583 IP6 2a03:9660:8c06:c136:89cd:37c3:e3e0:2202.https > 2001:dd70:3e3f:debb:d786:d0dd:9315:2bbf.65334: Flags [P.], seq 44736:46134, ack 1, win 122, options [nop,nop,TS val 1821317421 ecr 1069644019], length 1398
20:00:00.401750 IP6 2a03:9660:8c06:c136:89cd:37c3:e3e0:2202.https > 2001:dd70:3e3f:debb:d786:d0dd:9315:2bbf.65336: Flags [P.], seq 549863969:549864378, ack 2461293068, win 125, options [nop,nop,TS val 1821520078 ecr 1069643878], length 409
20:00:00.402488 IP6 2a03:9660:8c06:c136:89cd:37c3:e3e0:2202.https > 2001:dd70:3e3f:debb:d786:d0dd:9315:2bbf.65334: Flags [P.], seq 46134:47532, ack 1, win 122, options [nop,nop,TS val 1821317423 ecr 1069644020], length 1398
20:00:00.403303 IP6 2a03:9660:8c06:c136:89cd:37c3:e3e0:2202.https > 2001:dd70:3e3f:debb:d786:d0dd:9315:2bbf.65334: Flags [P.], seq 47532:48930, ack 1, win 122, options [nop,nop,TS val 1821317424 ecr 1069644020], length 1398
20:00:00.403489 IP6 2a03:9660:8c06:c136:89cd:37c3:e3e0:2202.https > 2001:dd70:3e3f:debb:d786:d0dd:9315:2bbf.65334: Flags [P.], seq 48930:50328, ack 1, win 122, options [nop,nop,TS val 1821317424 ecr 1069644020], length 1398
20:00:00.404293 IP6 2001:d980:1553:b97c:fb78:103d:e3e0:803b.ntp > 2001:dd70:3638:1fef:38b3:3c83:f184:967d.ntp:  [|ntp]
20:00:00.404477 IP6 2a03:9660:8c06:c136:89cd:37c3:e3e0:2202.https > 2001:dd70:3e3f:debb:d786:d0dd:9315:2bbf.65334: Flags [P.], seq 50328:51726, ack 1, win 122, options [nop,nop,TS val 1821317425 ecr 1069644021], length 1398
20:00:00.404484 IP6 2a03:9660:8c06:c136:89cd:37c3:e3e0:2202.https > 2001:dd70:3e3f:debb:d786:d0dd:9315:2bbf.65334: Flags [.], seq 51726:53124, ack 1, win 122, options [nop,nop,TS val 1821317425 ecr 1069644021], length 1398
20:00:00.404837 IP6 2601:5998:c3f3:d68a:3d4c:350c:9acf:7d7f.50030 > 2001:dd70:3bfd:6af:f872:44e7:fb3:d999.http: Flags [.], ack 1, win 65520, options [nop,nop,sack 1 {2049:161793}], length 0
20:00:00.404839 IP6 2601:5998:c3f3:d68a:3d4c:350c:9acf:7d7f.50030 > 2001:dd70:3bfd:6af:f872:44e7:fb3:d999.http: Flags [.], ack 1, win 65520, options [nop,nop,sack 1 {2049:162817}], length 0
20:00:00.405131 IP6 2001:db67:1c:f9fe:3b9:e871:dfe0:ff8d > 2001:dd70:3ff3:61b2:ff0f:e7b1:c900:81e2: ICMP6, time exceeded in-transit[|icmp6]
20:00:00.405334 IP6 2403:5cf8:c58e:f8cc:fc88:1e7c:1c03:9fd9.https > 2001:dd70:3e60:24fc:242c:cdb7:c9:823c.52421: Flags [.], ack 1073560518, win 926, options [nop,nop,TS val 1033436912 ecr 3824182861], length 0
20:00:00.405777 IP6 2a03:9660:8c06:c136:89cd:37c3:e3e0:2202.https > 2001:dd70:3e3f:debb:d786:d0dd:9315:2bbf.65334: Flags [P.], seq 53124:54522, ack 1, win 122, options [nop,nop,TS val 1821317426 ecr 1069644022], length 1398
20:00:00.406059 IP6 2001:dad7:3f0b:f93e:fbf6:1643:fc1f:1f2e.domain > 2001:dd70:3e3f:e6ee:fcc6:98c:23f9:ff0f.15513: 45211*-[|domain]
20:00:00.406720 IP6 2a03:9660:8ff1:478f:7832:b044:2300:8031.https > 2001:dd70:3e3f:dea8:5dd:626f:7cc3:6b7a.63285: Flags [.], seq 5592:6990, ack 1, win 579, options [nop,nop,TS val 2403127489 ecr 1001628391], length 1398
20:00:00.406899 IP6 2a03:9660:8c06:c136:89cd:37c3:e3e0:2202.https > 2001:dd70:3e3f:debb:d786:d0dd:9315:2bbf.65334: Flags [P.], seq 54522:55920, ack 1, win 122, options [nop,nop,TS val 1821317427 ecr 1069644022], length 1398
20:00:00.407284 IP6 2001:dd70:3e60:8530:4f7a:c68d:53b6:2296.50535 > 2a01:ef56:e00d:7e41:f8b6:9b3:fce3:1faf.http: Flags [.], ack 2481489704, win 27442, length 0
20:00:00.407384 IP6 2001:dd70:3ff3:2c27:6c0:bd85:60f6:614b.24374 > 2a01:ef56:e00d:7e41:f8b6:9b3:fce3:1faf.http: Flags [.], ack 14401, win 3724, length 0
20:00:00.407751 IP6 2a03:9660:8c06:c136:89cd:37c3:e3e0:2202.https > 2001:dd70:3e3f:debb:d786:d0dd:9315:2bbf.65334: Flags [P.], seq 55920:57318, ack 1, win 122, options [nop,nop,TS val 1821317428 ecr 1069644023], length 1398
20:00:00.408041 IP6 2a03:9660:8c06:c136:89cd:37c3:e3e0:2202.https > 2001:dd70:3e3f:debb:d786:d0dd:9315:2bbf.65334: Flags [.], seq 57318:58716, ack 1, win 122, options [nop,nop,TS val 1821317428 ecr 1069644023], length 1398
20:00:00.408146 IP6 2403:5cf8:c58e:f8cc:fc88:1e7c:1c03:9fd9.https > 2001:dd70:3e60:24fc:242c:cdb7:c9:823c.52421: Flags [.], seq 0:1428, ack 1, win 926, options [nop,nop,TS val 1033436914 ecr 3824182861], length 1428
20:00:00.408159 IP6 2403:5cf8:c58e:f8cc:fc88:1e7c:1c03:9fd9.https > 2001:dd70:3e60:24fc:242c:cdb7:c9:823c.52421: Flags [.], seq 1428:2856, ack 1, win 926, options [nop,nop,TS val 1033436914 ecr 3824182861], length 1428
20:00:00.408171 IP6 2403:5cf8:c58e:f8cc:fc88:1e7c:1c03:9fd9.https > 2001:dd70:3e60:24fc:242c:cdb7:c9:823c.52421: Flags [.], seq 2856:4284, ack 1, win 926, options [nop,nop,TS val 1033436914 ecr 3824182861], length 1428
20:00:00.408361 IP6 2403:5cf8:c58e:f8cc:fc88:1e7c:1c03:9fd9.https > 2001:dd70:3e60:24fc:242c:cdb7:c9:823c.52421: Flags [.], seq 4284:5712, ack 1, win 926, options [nop,nop,TS val 1033436914 ecr 3824182861], length 1428
20:00:00.408362 IP6 2403:5cf8:c58e:f8cc:fc88:1e7c:1c03:9fd9.https > 2001:dd70:3e60:24fc:242c:cdb7:c9:823c.52421: Flags [.], seq 5712:7140, ack 1, win 926, options [nop,nop,TS val 1033436914 ecr 3824182861], length 1428
20:00:00.408362 IP6 2403:5cf8:c58e:f8cc:fc88:1e7c:1c03:9fd9.https > 2001:dd70:3e60:24fc:242c:cdb7:c9:823c.52421: Flags [.], seq 7140:8568, ack 1, win 926, options [nop,nop,TS val 1033436914 ecr 3824182861], length 1428
20:00:00.408371 IP6 2403:5cf8:c58e:f8cc:fc88:1e7c:1c03:9fd9.https > 2001:dd70:3e60:24fc:242c:cdb7:c9:823c.52421: Flags [P.], seq 8568:9826, ack 1, win 926, options [nop,nop,TS val 1033436914 ecr 3824182861], length 1258
20:00:00.409470 IP6 2a03:9660:8c06:c136:89cd:37c3:e3e0:2202.https > 2001:dd70:3e3f:debb:d786:d0dd:9315:2bbf.65334: Flags [.], seq 58716:60114, ack 1, win 122, options [nop,nop,TS val 1821317430 ecr 1069644023], length 1398
20:00:00.409658 IP6 2a03:9660:8c06:c136:89cd:37c3:e3e0:2202.https > 2001:dd70:3e3f:debd:662a:5e15:f3e7:a5e8.51492: Flags [P.], seq 6990:8388, ack 1, win 131, options [nop,nop,TS val 3436220409 ecr 918303373], length 1398
20:00:00.409668 IP6 2a03:9660:8c06:c136:89cd:37c3:e3e0:2202.https > 2001:dd70:3e3f:debb:d786:d0dd:9315:2bbf.65334: Flags [P.], seq 60114:61512, ack 1, win 122, options [nop,nop,TS val 1821317430 ecr 1069644024], length 1398
20:00:00.409827 IP6 2601:5998:c3f3:d68a:3d4c:350c:9acf:7d7f.50030 > 2001:dd70:3bfd:6af:f872:44e7:fb3:d999.http: Flags [.], ack 1, win 65520, options [nop,nop,sack 1 {2049:165889}], length 0
20:00:00.409828 IP6 2601:5998:c3f3:d68a:3d4c:350c:9acf:7d7f.50030 > 2001:dd70:3bfd:6af:f872:44e7:fb3:d999.http: Flags [.], ack 1, win 65520, options [nop,nop,sack 1 {2049:166913}], length 0
20:00:00.409829 IP6 2601:5998:c3f3:d68a:3d4c:350c:9acf:7d7f.50030 > 2001:dd70:3bfd:6af:f872:44e7:fb3:d999.http: Flags [.], ack 1, win 65520, options [nop,nop,sack 1 {2049:167937}], length 0
20:00:00.409830 IP6 2601:5998:c3f3:d68a:3d4c:350c:9acf:7d7f.50030 > 2001:dd70:3bfd:6af:f872:44e7:fb3:d999.http: Flags [.], ack 1, win 65520, options [nop,nop,sack 1 {2049:168961}], length 0
20:00:00.409830 IP6 2601:5998:c3f3:d68a:3d4c:350c:9acf:7d7f.50030 > 2001:dd70:3bfd:6af:f872:44e7:fb3:d999.http: Flags [.], ack 1, win 65520, options [nop,nop,sack 1 {2049:169985}], length 0
20:00:00.409832 IP6 2601:5998:c3f3:d68a:3d4c:350c:9acf:7d7f.50030 > 2001:dd70:3bfd:6af:f872:44e7:fb3:d999.http: Flags [.], ack 1, win 65520, options [nop,nop,sack 1 {2049:171009}], length 0
20:00:00.409833 IP6 2601:5998:c3f3:d68a:3d4c:350c:9acf:7d7f.50030 > 2001:dd70:3bfd:6af:f872:44e7:fb3:d999.http: Flags [.], ack 1, win 65520, options [nop,nop,sack 1 {2049:172033}], length 0
20:00:00.409836 IP6 2601:5998:c3f3:d68a:3d4c:350c:9acf:7d7f.50030 > 2001:dd70:3bfd:6af:f872:44e7:fb3:d999.http: Flags [.], ack 1, win 65520, options [nop,nop,sack 1 {2049:173057}], length 0
20:00:00.409839 IP6 2601:5998:c3f3:d68a:3d4c:350c:9acf:7d7f.50030 > 2001:dd70:3bfd:6af:f872:44e7:fb3:d999.http: Flags [.], ack 1, win 65520, options [nop,nop,sack 1 {2049:174081}], length 0
20:00:00.409840 IP6 2601:5998:c3f3:d68a:3d4c:350c:9acf:7d7f.50030 > 2001:dd70:3bfd:6af:f872:44e7:fb3:d999.http: Flags [.], ack 1, win 65520, options [nop,nop,sack 1 {2049:175105}], length 0
20:00:00.410045 IP6 2a03:9660:8c06:c136:89cd:37c3:e3e0:2202.https > 2001:dd70:3e3f:debb:d786:d0dd:9315:2bbf.65334: Flags [P.], seq 61512:62910, ack 1, win 122, options [nop,nop,TS val 1821317430 ecr 1069644025], length 1398
20:00:00.410725 IP6 2a03:9660:8c06:c136:89cd:37c3:e3e0:2202.https > 2001:dd70:3e3f:debb:d786:d0dd:9315:2bbf.65334: Flags [P.], seq 62910:64308, ack 1, win 122, options [nop,nop,TS val 1821317431 ecr 1069644026], length 1398
20:00:00.411212 IP6 2001:dd70:3e60:8530:4f7a:c68d:53b6:2296.50535 > 2a01:ef56:e00d:7e41:f8b6:9b3:fce3:1faf.http: Flags [.], ack 10081, win 27442, length 0
20:00:00.411300 IP6 2a03:9660:8c06:c136:89cd:37c3:e3e0:2202.https > 2001:dd70:3e3f:debb:d786:d0dd:9315:2bbf.65334: Flags [P.], seq 64308:65706, ack 1, win 122, options [nop,nop,TS val 1821317432 ecr 1069644026], length 1398
20:00:00.411301 IP6 2a03:9660:8c06:c136:89cd:37c3:e3e0:2202.https > 2001:dd70:3e3f:debb:d786:d0dd:9315:2bbf.65334: Flags [P.], seq 65706:67104, ack 1, win 122, options [nop,nop,TS val 1821317432 ecr 1069644026], length 1398
20:00:00.411566 IP6 2a03:9660:8c06:c136:89cd:37c3:e3e0:2202.https > 2001:dd70:3e3f:debb:d786:d0dd:9315:2bbf.65334: Flags [P.], seq 67104:68502, ack 1, win 122, options [nop,nop,TS val 1821317432 ecr 1069644027], length 1398
20:00:00.412089 IP6 2a03:9660:8c06:c136:89cd:37c3:e3e0:2202.https > 2001:dd70:3e3f:debb:d786:d0dd:9315:2bbf.65334: Flags [P.], seq 68502:69900, ack 1, win 122, options [nop,nop,TS val 1821317433 ecr 1069644027], length 1398
20:00:00.412717 IP6 2a03:9660:8e19:3e8e:37c2:b035:ffff:82ef.https > 2001:dd70:3e3f:de97:3b4d:5198:c942:eade.33918: Flags [P.], seq 2835711034:2835711065, ack 118799163, win 120, options [nop,nop,TS val 3605720740 ecr 19879812], length 31
20:00:00.412784 IP6 2a03:9660:8c06:c136:89cd:37c3:e3e0:2202.https > 2001:dd70:3e3f:debb:d786:d0dd:9315:2bbf.65334: Flags [P.], seq 69900:71298, ack 1, win 122, options [nop,nop,TS val 1821317434 ecr 1069644028], length 1398
20:00:00.412976 IP6 2001:dd70:3e60:8530:4f7a:c68d:53b6:2296.50535 > 2a01:ef56:e00d:7e41:f8b6:9b3:fce3:1faf.http: Flags [.], ack 24481, win 27442, length 0
20:00:00.413332 IP6 2a03:9660:8c06:c136:89cd:37c3:e3e0:2202.https > 2001:dd70:3e3f:debb:d786:d0dd:9315:2bbf.65334: Flags [.], seq 71298:72696, ack 1, win 122, options [nop,nop,TS val 1821317434 ecr 1069644028], length 1398
20:00:00.413627 IP6 2a03:9660:8ff1:478f:7832:b044:2300:8031.https > 2001:dd70:3e3f:dea8:5dd:626f:7cc3:6b7a.63285: Flags [P.], seq 6990:8388, ack 1, win 579, options [nop,nop,TS val 2403127497 ecr 1001628393], length 1398
20:00:00.413902 IP6 2a03:9660:8ff1:4793:c8c2:cfb5:dc03:972c.https > 2001:dd70:3e3f:dea8:5dd:626f:7cc3:6b7a.63297: Flags [.], seq 1462511603:1462513001, ack 3642026236, win 851, options [nop,nop,TS val 402723138 ecr 1001628395], length 1398
20:00:00.413903 IP6 2a03:9660:8ff1:4793:c8c2:cfb5:dc03:972c.https > 2001:dd70:3e3f:dea8:5dd:626f:7cc3:6b7a.63297: Flags [.], seq 1398:2796, ack 1, win 851, options [nop,nop,TS val 402723138 ecr 1001628395], length 1398
20:00:00.414342 IP6 2a03:9660:8ff1:4793:c8c2:cfb5:dc03:972c.https > 2001:dd70:3e3f:dea8:5dd:626f:7cc3:6b7a.63297: Flags [.], seq 2796:4194, ack 1, win 851, options [nop,nop,TS val 402723139 ecr 1001628398], length 1398
20:00:00.414763 IP6 2a03:9660:8e19:3e8c:4bc2:c9f4:20e3:5a45.https > 2001:dd70:3ea8:f828:d24c:2bf0:8482:ca6d.52520: Flags [P.], seq 1670786123:1670786169, ack 654419431, win 301, length 46
20:00:00.414763 IP6 2a03:9660:8e19:3e8c:4bc2:c9f4:20e3:5a45.https > 2001:dd70:3ea8:f828:d24c:2bf0:8482:ca6d.52520: Flags [F.], seq 77, ack 1, win 301, length 0
20:00:00.415214 IP6 2001:db08:ffef:440a:f870:842:1f03:6032 > 2001:dd70:3ff3:61b2:ff0f:e7b1:c900:81e2: ICMP6, time exceeded in-transit[|icmp6]
20:00:00.415318 IP6 2a03:9660:8c06:c136:89cd:37c3:e3e0:2202.https > 2001:dd70:3e3f:debd:662a:5e15:f3e7:a5e8.51492: Flags [P.], seq 8388:9786, ack 1, win 131, options [nop,nop,TS val 3436220416 ecr 918303374], length 1398
20:00:00.415366 IP6 2a03:9660:8c06:c136:89cd:37c3:e3e0:2202.https > 2001:dd70:3e3f:debb:d786:d0dd:9315:2bbf.65334: Flags [P.], seq 72696:74094, ack 1, win 122, options [nop,nop,TS val 1821317437 ecr 1069644029], length 1398
20:00:00.415518 IP6 2a03:9660:8c06:c136:89cd:37c3:e3e0:2202.https > 2001:dd70:3e3f:debd:662a:5e15:f3e7:a5e8.51492: Flags [P.], seq 11184:12582, ack 1, win 131, options [nop,nop,TS val 3436220416 ecr 918303375], length 1398
20:00:00.415675 IP6 2a03:9660:8c06:c136:89cd:37c3:e3e0:2202.https > 2001:dd70:3e3f:debb:d786:d0dd:9315:2bbf.65334: Flags [P.], seq 74094:75492, ack 1, win 122, options [nop,nop,TS val 1821317437 ecr 1069644030], length 1398
20:00:00.415904 IP6 2a03:9660:8c06:c136:89cd:37c3:e3e0:2202.https > 2001:dd70:3e3f:debd:662a:5e15:f3e7:a5e8.51492: Flags [P.], seq 12582:13980, ack 1, win 131, options [nop,nop,TS val 3436220416 ecr 918303376], length 1398
20:00:00.416255 IP6 2a03:9660:8c06:c136:89cd:37c3:e3e0:2202.https > 2001:dd70:3e3f:debb:d786:d0dd:9315:2bbf.65334: Flags [P.], seq 75492:76890, ack 1, win 122, options [nop,nop,TS val 1821317437 ecr 1069644030], length 1398
20:00:00.416336 IP6 2a03:9660:8c06:c136:89cd:37c3:e3e0:2202.https > 2001:dd70:3e3f:debd:662a:5e15:f3e7:a5e8.51492: Flags [.], seq 13980:15378, ack 1, win 131, options [nop,nop,TS val 3436220417 ecr 918303377], length 1398
20:00:00.416387 IP6 2a03:9660:8e19:3e8c:4bc2:c9f4:20e3:5a45.https > 2001:dd70:3ea8:f821:8225:16b3:54f0:31f7.53944: Flags [.], ack 4125521248, win 123, length 0
20:00:00.416485 IP6 2601:5998:c3f3:d68a:3d4c:350c:9acf:7d7f.50030 > 2001:dd70:3bfd:6af:f872:44e7:fb3:d999.http: Flags [.], ack 1, win 65520, options [nop,nop,sack 1 {2049:176129}], length 0
20:00:00.416487 IP6 2601:5998:c3f3:d68a:3d4c:350c:9acf:7d7f.50030 > 2001:dd70:3bfd:6af:f872:44e7:fb3:d999.http: Flags [.], ack 1, win 65520, options [nop,nop,sack 1 {2049:177153}], length 0
20:00:00.416487 IP6 2601:5998:c3f3:d68a:3d4c:350c:9acf:7d7f.50030 > 2001:dd70:3bfd:6af:f872:44e7:fb3:d999.http: Flags [.], ack 1, win 65520, options [nop,nop,sack 1 {2049:178177}], length 0
20:00:00.416610 IP6 2001:dd70:3ff3:61b2:ff0f:e7b1:c900:81e2 > 2a00:abf7:17e3:40ce:7f7:f632:3f1f:7f51: ICMP6, echo request, seq 19, length 56
20:00:00.416617 IP6 2a03:9660:8c06:c136:89cd:37c3:e3e0:2202.https > 2001:dd70:3e3f:debd:662a:5e15:f3e7:a5e8.51492: Flags [P.], seq 15378:16776, ack 1, win 131, options [nop,nop,TS val 3436220417 ecr 918303378], length 1398
20:00:00.416619 IP6 2001:dd70:3e60:8530:4f7a:c68d:53b6:2296.50535 > 2a01:ef56:e00d:7e41:f8b6:9b3:fce3:1faf.http: Flags [.], ack 38881, win 27442, length 0
20:00:00.416639 IP6 2a03:9660:8e19:3e8c:4bc2:c9f4:20e3:5a45.https > 2001:dd70:3ea8:f821:8225:16b3:54f0:31f7.53944: Flags [P.], seq 0:42, ack 1, win 123, length 42
20:00:00.416672 IP6 2601:5998:c3f3:d68a:3d4c:350c:9acf:7d7f.50030 > 2001:dd70:3bfd:6af:f872:44e7:fb3:d999.http: Flags [.], ack 1, win 65520, options [nop,nop,sack 1 {2049:179201}], length 0
20:00:00.416801 IP6 2a03:9660:8c06:c136:89cd:37c3:e3e0:2202.https > 2001:dd70:3e3f:debd:662a:5e15:f3e7:a5e8.51492: Flags [P.], seq 16776:18174, ack 1, win 131, options [nop,nop,TS val 3436220417 ecr 918303379], length 1398
20:00:00.416997 IP6 2001:dd70:3e60:8530:4f7a:c68d:53b6:2296.50535 > 2a01:ef56:e00d:7e41:f8b6:9b3:fce3:1faf.http: Flags [.], ack 53281, win 27442, length 0
20:00:00.417083 IP6 2a03:9660:8c06:c136:89cd:37c3:e3e0:2202.https > 2001:dd70:3e3f:debd:662a:5e15:f3e7:a5e8.51492: Flags [P.], seq 18174:19572, ack 1, win 131, options [nop,nop,TS val 3436220417 ecr 918303380], length 1398
20:00:00.417085 IP6 2001:dd70:3e60:8530:4f7a:c68d:53b6:2296.50535 > 2a01:ef56:e00d:7e41:f8b6:9b3:fce3:1faf.http: Flags [.], ack 64801, win 27442, length 0
20:00:00.417109 IP6 2a03:9660:8c06:c136:89cd:37c3:e3e0:2202.https > 2001:dd70:3e3f:debb:d786:d0dd:9315:2bbf.65334: Flags [P.], seq 76890:78288, ack 1, win 122, options [nop,nop,TS val 1821317438 ecr 1069644031], length 1398
20:00:00.417252 IP6 2001:dd70:3e60:8530:4f7a:c68d:53b6:2296.50535 > 2a01:ef56:e00d:7e41:f8b6:9b3:fce3:1faf.http: Flags [.], ack 70561, win 27442, length 0
20:00:00.417445 IP6 2a03:9660:8c06:c136:89cd:37c3:e3e0:2202.https > 2001:dd70:3e3f:debd:662a:5e15:f3e7:a5e8.51492: Flags [.], seq 19572:20970, ack 1, win 131, options [nop,nop,TS val 3436220418 ecr 918303382], length 1398
20:00:00.417572 IP6 2a03:9660:8c06:c136:89cd:37c3:e3e0:2202.https > 2001:dd70:3e3f:debb:d786:d0dd:9315:2bbf.65334: Flags [P.], seq 78288:79686, ack 1, win 122, options [nop,nop,TS val 1821317438 ecr 1069644031], length 1398
20:00:00.417691 IP6 2a03:9660:8e19:3e8c:4bc2:c9f4:20e3:5a45.https > 2001:dd70:3e60:80d1:8bbe:a55c:e6f:a121.65469: Flags [.], seq 42:1440, ack 1, win 564, options [nop,nop,TS val 2000731620 ecr 758948842], length 1398
20:00:00.417692 IP6 2a03:9660:8e19:3e8c:4bc2:c9f4:20e3:5a45.https > 2001:dd70:3e60:80d1:8bbe:a55c:e6f:a121.65469: Flags [P.], seq 1440:1534, ack 1, win 564, options [nop,nop,TS val 2000731620 ecr 758948842], length 94
20:00:00.417694 IP6 2a03:9660:8e19:3e8c:4bc2:c9f4:20e3:5a45.https > 2001:dd70:3e60:80d1:8bbe:a55c:e6f:a121.65469: Flags [.], seq 1534:2932, ack 1, win 564, options [nop,nop,TS val 2000731620 ecr 758948842], length 1398
20:00:00.417695 IP6 2a03:9660:8e19:3e8c:4bc2:c9f4:20e3:5a45.https > 2001:dd70:3e60:80d1:8bbe:a55c:e6f:a121.65469: Flags [.], seq 2932:3063, ack 1, win 564, options [nop,nop,TS val 2000731620 ecr 758948842], length 131
20:00:00.417695 IP6 2a03:9660:8ff1:4793:c8c2:cfb5:dc03:972c.https > 2001:dd70:3e3f:dea8:ca00:3af9:a8bc:ec8e.49853: Flags [.], seq 8096:9494, ack 1, win 223, options [nop,nop,TS val 2480309602 ecr 627380153], length 1398
20:00:00.417696 IP6 2a03:9660:8ff1:4793:c8c2:cfb5:dc03:972c.https > 2001:dd70:3e3f:dea8:ca00:3af9:a8bc:ec8e.49853: Flags [.], seq 9494:9625, ack 1, win 223, options [nop,nop,TS val 2480309602 ecr 627380153], length 131
20:00:00.417697 IP6 2a03:9660:8ff1:4793:c8c2:cfb5:dc03:972c.https > 2001:dd70:3e3f:dea8:ca00:3af9:a8bc:ec8e.49853: Flags [.], seq 9625:11023, ack 1, win 223, options [nop,nop,TS val 2480309602 ecr 627380153], length 1398
20:00:00.417698 IP6 2a03:9660:8e19:3e8c:4bc2:c9f4:20e3:5a45.https > 2001:dd70:3e60:80d1:8bbe:a55c:e6f:a121.65469: Flags [P.], seq 3063:4151, ack 1, win 564, options [nop,nop,TS val 2000731620 ecr 758948842], length 1088
20:00:00.417699 IP6 2a03:9660:8ff1:4793:c8c2:cfb5:dc03:972c.https > 2001:dd70:3e3f:dea8:ca00:3af9:a8bc:ec8e.49853: Flags [.], seq 11023:12235, ack 1, win 223, options [nop,nop,TS val 2480309602 ecr 627380153], length 1212
20:00:00.417700 IP6 2a03:9660:8ff1:4793:c8c2:cfb5:dc03:972c.https > 2001:dd70:3e3f:dea8:ca00:3af9:a8bc:ec8e.49853: Flags [.], seq 12235:13633, ack 1, win 223, options [nop,nop,TS val 2480309602 ecr 627380153], length 1398
20:00:00.417700 IP6 2a03:9660:8ff1:4793:c8c2:cfb5:dc03:972c.https > 2001:dd70:3e3f:dea8:ca00:3af9:a8bc:ec8e.49853: Flags [.], seq 13633:15031, ack 1, win 223, options [nop,nop,TS val 2480309602 ecr 627380153], length 1398
20:00:00.417701 IP6 2a03:9660:8ff1:4793:c8c2:cfb5:dc03:972c.https > 2001:dd70:3e3f:dea8:ca00:3af9:a8bc:ec8e.49853: Flags [P.], seq 15031:16192, ack 1, win 223, options [nop,nop,TS val 2480309602 ecr 627380153], length 1161
20:00:00.417703 IP6 2a03:9660:8e19:3e8c:4bc2:c9f4:20e3:5a45.https > 2001:dd70:3e60:80d1:8bbe:a55c:e6f:a121.65469: Flags [.], seq 4151:5549, ack 1, win 564, options [nop,nop,TS val 2000731620 ecr 758948842], length 1398
20:00:00.417704 IP6 2a03:9660:8e19:3e8c:4bc2:c9f4:20e3:5a45.https > 2001:dd70:3e60:80d1:8bbe:a55c:e6f:a121.65469: Flags [.], seq 5549:5680, ack 1, win 564, options [nop,nop,TS val 2000731620 ecr 758948842], length 131
20:00:00.417705 IP6 2a03:9660:8e19:3e8c:4bc2:c9f4:20e3:5a45.https > 2001:dd70:3e60:80d1:8bbe:a55c:e6f:a121.65469: Flags [.], seq 5680:7078, ack 1, win 564, options [nop,nop,TS val 2000731620 ecr 758948842], length 1398
20:00:00.417706 IP6 2a03:9660:8e19:3e8c:4bc2:c9f4:20e3:5a45.https > 2001:dd70:3e60:80d1:8bbe:a55c:e6f:a121.65469: Flags [.], seq 7078:8290, ack 1, win 564, options [nop,nop,TS val 2000731620 ecr 758948842], length 1212
20:00:00.417757 IP6 2a03:9660:8e19:3e8c:4bc2:c9f4:20e3:5a45.https > 2001:dd70:3e60:80d1:8bbe:a55c:e6f:a121.65469: Flags [.], seq 8290:9688, ack 1, win 564, options [nop,nop,TS val 2000731620 ecr 758948842], length 1398
20:00:00.417758 IP6 2a03:9660:8e19:3e8c:4bc2:c9f4:20e3:5a45.https > 2001:dd70:3e60:80d1:8bbe:a55c:e6f:a121.65469: Flags [.], seq 9688:11086, ack 1, win 564, options [nop,nop,TS val 2000731620 ecr 758948842], length 1398
